hash_id,code,kind,repeat,desc,narrative
93c764296f2a868c,3.6(a)(1),,True,PRIMARY ENCLOSURES.,"In the northern most outdoor portion of the kennel there is a set of primary enclosures constructed from various
types of fencing material. One of the enclosures contains an adult female Mastiff, chip# 0A01594662. The dealer
stated the animal had recently weaned puppies then had been placed in it's current enclosure approximately a week
prior. The enclosure gate is partially constructed from chain link type wire that is bent and pulled with ends
protruding into the enclosure. There is a large tree limb laying on the eastern fence panel, a broken limb hanging
above the turned over shelter which contains wet hay, throne brier type vines climbing on the western fence panel
and weeds over twelve inches tall growing inside of the enclosure. The gate needs to be repaired or replaced, the
shelter needs to be placed upright and cleaned, the broken limbs, briers and weeds need to be removed to protect
the contained animal from injury, to contain it securely and to protect it's health and welfare.
Affects one adult"
93c764296f2a868c,3.9(b),,False,FEEDING.,"In the outdoor portion of the kennel facility there are three sets of enclosures which contain regulated animals, One
set of the enclosures is attached to the exterior of a semi type trailer. The self feeders are attached to the enclosure
fence panels. The previous day there were rain storms. During the inspection one of the self feeders had wet food
in the bottom and dry food on top with food waste on the ground surface. Food receptacles must be used for dogs,
must be readily accessible to all dogs, and must be located so as to minimize contamination by excreta and pests,
and be protected from rain and snow. The food receptacle and surrounding area needs to be cleaned and dry food
provided to the contained animal. All food receptacles must be protected from inclement weather for all animals in
all enclosures to protect the food source from contamination.
Affects one adult Correct by September 4, 2014"
93c764296f2a868c,3.11(c),,False,"CLEANING, SANITIZATION, HOUSEKEEPING, AND PEST CONTROL.","The red sheltered building which contains sick puppies under vet care and the indoor whelping building which
contains a mother and puppies need to be cleaned to remove the accumulations of dead flying inspects from the
floors, wash downs, interior building fixtures and window ledges. Premises where housing facilities are located,
including buildings and surrounding grounds, must be kept clean and in good repair to protect the animals from
injury, to facilitate husbandry practices and to reduce or eliminate breeding and living areas for rodents and other
pests and vermin and prevent the spread of disease.
Affects one adult and twenty puppies. Correct September 5, 2014
The inspection and exit interview was conducted with the facility representative.
Additional Inspectors
Cooper Natalie, Veterinary Medical Officer"
bd7642593c03be09,3.11(c),,True,"CLEANING, SANITIZATION, HOUSEKEEPING, AND PEST CONTROL.","The indoor whelping building which contains mothers and puppies needs to be cleaned to remove the
accumulations of dead flying inspects from the floors, wash downs, interior building fixtures and window ledges.
Premises where housing facilities are located, including buildings and surrounding grounds, must be kept clean and
in good repair to protect the animals from injury, to facilitate husbandry practices and to reduce or eliminate
breeding and living areas for rodents and other pests and vermin and prevent the spread of disease.
Affects two adults and ten puppies.
The inspection and exit interview was conducted with the facility representative.
Additional Inspectors
Cooper Natalie, Veterinary Medical Officer"
f524957ef85d8de6,3.1(e),,False,"HOUSING FACILITIES, GENERAL.","The kennel facility consists of one indoor housing building and an outdoor housing area. Next to the outdoor
housing area is a building which contains the stored food material. Inside of the building there are two metal barrels
for the dry food storage. During the inspection one of the barrels did not have it's lid. Supplies of food must be
stored in a manner that protects the supplies from spoilage, contamination, and vermin infestation. All open supplies
of food must be kept in leakproof containers with tightly fitting lids to prevent contamination and spoilage.
Affects twenty-two adults and two puppies over eight weeks of age. Correct by March 23, 2015
The inspection and exit briefing was conducted with the Representatives.
Additional Inspectors
Lies John, Animal Care Inspector"
2aeff56295d7f546,2.40(b)(2),,False,ATTENDING VETERINARIAN AND ADEQUATE VETERINARY CARE (DEALERS AND EXHIBITORS).,"The kennel facility consists of one indoor housing building and one outdoor housing area. During the inspection a
three year old white male English Bulldog, chip #0A02091138 was observed with crusty green matter around it's left
eye. The dealer did not have any written documentation the animal had been evaluated and or treated by the
attending veterinarian for this condition. The dealer did not have any written documentation of treating the animal.
The animal must be evaluated by the attending veterinarian. The dealer must maintain written documentation of the
evaluation and all treatment.
Affects one adult. Correct by July 13, 2015"
2aeff56295d7f546,3.1(f),,False,"HOUSING FACILITIES, GENERAL.","The outdoor housing area is composed of ground enclosures with a compacted earth floor surface. During the
inspection four of the outdoor enclosures had standing water and mud causing the contained animals to stay wet
and muddy. The enclosure floor surfaces need to be repaired and maintained to minimizes contamination and
disease risks. The enclosures must have better drainage to insure the animals can stay clean and dry, to protect
their health and welfare.
Affects four adults. July 17, 2015"
2aeff56295d7f546,3.11(a),,False,"CLEANING, SANITIZATION, HOUSEKEEPING, AND PEST CONTROL.","The outdoor housing area consists of one row of attached enclosures and a lone enclosures attached to a trailer.
The lone enclosure contained one small white French Bulldog during the inspection. The primary enclosure
contained more than one days accumulation of waste material. The dealer stated she had last removed waste
material from the enclosure four days prior. Excreta must be removed from primary enclosures daily to prevent an
excessive accumulation of feces and food waste, to prevent soiling of the dogs contained in the primary enclosures,
and to reduce disease hazards, insects, pests and odors.
Affects four adults. July 10, 2015
The inspection and exit briefing was conducted with the facility representatives.
Additional Inspectors
Cooper Natalie, Veterinary Medical Officer"
c6c7146cc772707a,3.4(b)(3),,False,OUTDOOR HOUSING FACILITIES.,"Outdoor shelters must have a rain and wind break at the entrance. None of the outdoor shelters have a wind break
at the entrance. The owner must add wind breaks to help dogs stay warm during the winter months. This will help
in keeping dogs warm and healthy during the cold winter winds. Correct by 02-19-2017.
This inspection and exit briefing were conducted with the owner and Karl Thornton, ACI."
af4f72eb6c4ba985,2.50(a)(2),,False,TIME AND METHOD OF IDENTIFICATION.,"Identification.
***There were 8 puppies which were less than 16 weeks of age at the facility that did not have individual
identification. There were no cage cards on the enclosures to identify the puppies. Identification is required in order
to ensure that each animal's identity can be known with certainty and to facilitate record keeping requirements. The
licensee must ensure that all dogs less than 16 weeks of age are identified by an official tag as described in Sec.
2.51, a legible tattoo approved by the Administrator, a microchip, or a cage card (if maintained as a litter with their
dam and housed within the same primary enclosure).
To be corrected by: June 8, 2014."
af4f72eb6c4ba985,3.1(c)(3),,True,"HOUSING FACILITIES, GENERAL.","(c) Surfaces- (3) Cleaning.
***The sheltered building, along most of the underside of the east and west run of enclosures on the outside,
effecting approximately 62 dogs there is a buildup of hair, feces, and grime. Ten dog entry doors had a buildup of a
brownish grime covering about 30% - 50% of the doorway. The accumulation of the dirt and grime can cause
diseases and attract pests. Cleanliness is important to the health and well-being of the animals. The licensee must
ensure animal enclosures, areas inside of housing facility and adjacent areas must be kept clean to ensure the
health and well-being of the animals. The licensee must spot clean daily as required.
Inspection and exit interview conducted with licensee.
Additional Inspectors
Heine William, Animal Care Inspector"
1d60f342ac4dcab2,2.40(b)(2),,False,ATTENDING VETERINARIAN AND ADEQUATE VETERINARY CARE (DEALERS AND EXHIBITORS).,"Inside of the whelping facility there was an uncapped needle attached to a syringe, and a capped needle and
syringe laying on top of a metal file cabinet ready for use. When the inspector asked the licensee what they were
for, he said that they were for giving vaccines and medications to the dogs and puppies. When asked if he was
using a new needle and syringe for each dog or puppy the licensee said (cid:28)""No"" that he would use the same needle
and syringe for the same product for all of the dogs/puppies but would clean the syringes/needles out with water in
between uses of a different product. Using the same needle and syringe on different dogs and puppies and/or with
different products could spread disease from one animal to another, may cause infection at the puncture site, and
may contaminate the medication or vaccine. The licensee must use a new needle and syringe for each dog or
puppy for injections and must NOT reuse the same needle and syringe for different medication or vaccines. The
licensee must ensure for the use of appropriate methods to prevent, control, diagnose, and treat diseases and
injuries at all times.
To be corrected from this day forward"
1d60f342ac4dcab2,3.1(c)(3),,True,"HOUSING FACILITIES, GENERAL.","(c) Surfaces- (3) Cleaning.
***The sheltered building, along most of the underside of the east and west run of enclosures on the outside,
effecting approximately 47 dogs there is a buildup of hair, feces, and grime. On the inside of the building there is a
build up of dust, dirt, cobwebs and fly spat on all of the walls and ceilings. When questioned by the inspectors as to
when the last time he had performed a good cleaning of the interior of the building the licensee replied ""Last Fall"".
The floors of the sheltered facility are mostly covered in a layer of dust and dirt. The accumulation of the dirt and
grime can cause diseases and attract pests. Cleanliness is important to the health and well-being of the
animals.The licensee must ensure that hard surfaces with which the dogs come in contact with are spot-cleaned
daily and sanitized at least once every two weeks (or more often if necessary). All other surfaces of housing
facilities must be cleaned and sanitized when necessary to satisfy generally accepted husbandry standards and
practices.
Additional Inspectors
Proctor Chad, Animal Care Inspector"
444dbb7c9b7afac1,2.126(b),,False,ACCESS AND INSPECTION OF RECORDS AND PROPERTY; SUBMISSION OF ITINERARIES.,"Section 2.126(b) - Access and inspection of records and property:
A responsible adult was not available to accompany APHIS Officials during the inspection process at 10 am on
03/17/2015."
f9094afda09e74d0,2.126(b),,False,ACCESS AND INSPECTION OF RECORDS AND PROPERTY; SUBMISSION OF ITINERARIES.,"Section 2.126(b) - Access and inspection of records and property:
A responsible adult was not available to accompany APHIS Officials during the inspection process at 10 am on
06/15/2016."
0eb9c2dbf397ae99,2.126(b),,True,ACCESS AND INSPECTION OF RECORDS AND PROPERTY; SUBMISSION OF ITINERARIES.,"A responsible adult was not available to accompany APHIS Officials during the inspection process at 11 am on
22-NOV-16.
Talked to licensee, as they were leaving."
19843be4cbbd8974,2.126(b),,False,ACCESS AND INSPECTION OF RECORDS AND PROPERTY; SUBMISSION OF ITINERARIES.,"A responsible adult was not available to accompany APHIS Officials during the inspection process at 11 am on
10-APR-17.
Talked to family member at the house, letting me know availability."
9dbbdad6039c617f,2.126(b),,False,ACCESS AND INSPECTION OF RECORDS AND PROPERTY; SUBMISSION OF ITINERARIES.,"A responsible adult was not available to accompany APHIS Officials during the inspection process at 11 am on
03-Apr-18.
Talked to a family member, who let me know the licensee was gone for the day."
dd64ddb9fb4a9993,2.126(c),,False,ACCESS AND INSPECTION OF RECORDS AND PROPERTY; SUBMISSION OF ITINERARIES.,"The licensee is currently in travel status and did not submit a written itinerary to the Animal Care Regional Director
prior to traveling with the animals.
The itinerary shall be received by the AC Regional Director no fewer than 2 days in advance of any travel and shall
contain complete and accurate information concerning the whereabouts of any animal intended for exhibition at any
location other than the person's approved site.
(1) The itinerary shall include the following:
(i) The name of the person who intends to exhibit the animal and transport the animal for exhibition purposes,
including any business name and current Act license or registration number and, in the event that any animal is
leased, borrowed, loaned, or under some similar arrangement, the name of the person who owns such animal;
(ii) The name, identification number or identifying characteristics, species (common or scientific name), sex and age
of each animal; and
(iii) The names, dates, and locations (with addresses) where the animals will travel, be housed, and be exhibited,
including all anticipated dates and locations (with addresses) for any stops and layovers that allow or require
removal
of the animals from the transport enclosures. Unanticipated delays of such length shall be reported to the AC
Regional Director the next APHIS business day. APHIS Regional offices are available each weekday, except on
Federal holidays, from 8 a.m. to 5 p.m.
To be corrected for all future travel"
dd64ddb9fb4a9993,3.6(c)(1)(1),,True,PRIMARY ENCLOSURES.,"It was observed that 1 dog, Nevada, was in an enclosure that did not provide adequate space. Nevada measured
21 inches
(nose to base of tail), and would therefore require 729 square inches of floor space, but only had 432. All dogs and
their enclosures should be measured, and changes should be made as needed to ensure that all dogs have
adequate floor space in their primary enclosures. Adequate floor space is required in order to promote the health
and well-being of the animals.
This was previously cited at their 002 site.
Original correction date 2/15/14"
dd64ddb9fb4a9993,3.6(c)(1)(2),,True,PRIMARY ENCLOSURES.,"It was observed that two dogs, Nevada and Deusa, were in enclosures that did not meet the height requirements for
primary enclosures: they did not provide at least six inches of space above the heads of the dogs when they are
standing normally. Not all dogs were observed in their enclosures. All dogs and their enclosures should be
measured, and changes should be made as needed to ensure that all dogs have adequate height in their primary
enclosures. Adequate height is required in order to promote the health and well-being of the animals.
This was previously cited at their 002 site.
Original correction date 2/15/14"
dd64ddb9fb4a9993,3.8(c)(1)(1),,False,EXERCISE FOR DOGS.,"The group housing pen for exercising the dogs during the day does not provide at least 100 percent of the required
space for each dog if maintained separately under the minimum floor space requirements of Sec. 3.6(c)(1) of this
subpart. Although the facility provides the dogs with additional exercise on a regular basis through walking and
conditioning sessions, the floor space available when they are housed together does not meet the minimum space
requirements.
To be corrected by June 1, 2014"
dd64ddb9fb4a9993,3.8,,False,EXERCISE FOR DOGS.,"The exhibitor did not have a written exercise plan approved by the attending veterinarian. According to the owner,
the dogs are in the exercise pen each day and are regularly given walks and receive positive physical contact with
the owner during conditioning sessions. The exhibitor must develop, document, and follow an appropriate plan to
provide dogs with the opportunity for exercise. This plan must be approved by the attending veterinarian. The plan
must be made available to APHIS personnel at time of inspection.
To be corrected by June 1, 2014
An exit briefing was conducted with the facility representative.
The inspection was conducted in Canoga Park, CA"
3d94fd120f6e1803,2.40(a)(1),,False,ATTENDING VETERINARIAN AND ADEQUATE VETERINARY CARE (DEALERS AND EXHIBITORS).,"The licensee has an attending veterinarian, however the written Program of Veterinary Care (PVC) made available
at time of this inspection needs more detail. The Parasite Control Program has no guidelines for the frequency of
sampling or treatment. Emergency Care provisions need more detail in regards to who will provide emergency care
if the attending veterinarian is unavailable. The licensee must consult with the attending veterinarian and develop a
more complete and accurate written program of veterinary care. This information is important so that the
preventative medicine program established and implemented will ensure that the animals are maintained in good
health.
Correct by 03/20/15"
3d94fd120f6e1803,2.126(c),,True,ACCESS AND INSPECTION OF RECORDS AND PROPERTY; SUBMISSION OF ITINERARIES.,"The licensee is currently in travel status and did not submit a written itinerary to the Animal Care Regional Director
prior to traveling with the animals.
The itinerary shall be received by the AC Regional Director no fewer than 2 days in advance of any travel and shall
contain complete and accurate information concerning the whereabouts of any animal intended for exhibition at any
location other than the person's approved site.
(1) The itinerary shall include the following:
(i) The name of the person who intends to exhibit the animal and transport the animal for exhibition purposes,
including any business name and current Act license or registration number and, in the event that any animal is
leased, borrowed, loaned, or under some similar arrangement, the name of the person who owns such animal;
(ii) The name, identification number or identifying characteristics, species (common or scientific name), sex and age
of each animal; and
(iii) The names, dates, and locations (with addresses) where the animals will travel, be housed, and be exhibited,
including all anticipated dates and locations (with addresses) for any stops and layovers that allow or require
removal
of the animals from the transport enclosures. Unanticipated delays of such length shall be reported to the AC
Regional Director the next APHIS business day. APHIS Regional offices are available each weekday, except on
Federal holidays, from 8 a.m. to 5 p.m.
Original Correction date: To be corrected for all future travel
This was cited during an inspection at a previous travel site.
Exit interview conducted with facility representative.
Inspection conducted in Las Vegas, NV."
8407f74b8227d984,2.126(b),,False,ACCESS AND INSPECTION OF RECORDS AND PROPERTY; SUBMISSION OF ITINERARIES.,"Section 2.126(b) - Access and inspection of records and property: A responsible adult shall be made available to
accompany APHIS officials during the inspection process.
A responsible adult was not available to accompany APHIS Officials during the inspection process at 11:30 a.m. on
06/10/2015.
This location was near the intersection of San Fernando Rd. and Hubbard St. in Sylmar, CA.
Additional Inspectors
Andricos Alexandra, Veterinary Medical Officer"
bde63ef074784184,3.1(c)(1)(1),,False,"HOUSING FACILITIES, GENERAL.","On the outdoor exercise pen, there is one metal gate panel and support beam that has an excessive build up of
rust.
In addition, there are approximately 4 kennels in the housing trailer that have small areas of rust build up. The
presence of rust may prevent the required cleaning and sanitizing and/or can affect the integrity of the surface.
Surfaces that come in contact with the dogs should be free of excessive rust that prevents the required cleaning and
sanitization, or that affects the structural strength of the surface. A system should be in place to identify, repair/
replace rusted surfaces that come in contact with the dogs.
To be corrected by February 15, 2015"
bde63ef074784184,3.11(a),,False,"CLEANING, SANITIZATION, HOUSEKEEPING, AND PEST CONTROL.","Inside the dog trailer, a moderate amount of hair and other debris is collecting between the individual dog kennels.
Accumulations of hair, dust and other debris can attract pests and/ or increase disease hazards in animal areas.
Primary enclosures, including the spaces between each kennel, should be cleaned as often as needed to facilitate
the husbandry practices required in this subpart. A system should be in place and maintained to ensure the required
cleaning is completed in a timely manner.
To be corrected by February 15, 2016
An exit briefing was conducted with the facility representative.
Accompanied on inspection by Dr. Tyler Fields, VMO.
Inspection site: Hwy 62 in Yucca Valley, CA.
Additional Inspectors
Fields Tyler, Veterinary Medical Officer"
99580e4789e9ea36,3.1(c)(1),,True,"HOUSING FACILITIES, GENERAL.","There are approximately 4 kennels in the housing trailer that have areas of rust build up. The
presence of rust may prevent the required cleaning and sanitizing and/or can affect the integrity of the surface.
Surfaces that come in contact with the dogs should be free of excessive rust that prevents the required cleaning and
sanitization, or that affects the structural strength of the surface. A system should be in place to identify,
repair/replace rusted surfaces that come in contact with the dogs."
99580e4789e9ea36,3.1(c)(2),,False,"HOUSING FACILITIES, GENERAL.","There are 2 dog kennels with wood floors that are worn and not sealed. In the trailer, there is a small section
missing of the linoleum floor and the underlying surface is exposed.These surfaces cannot be readily cleaned and
sanitized and can lead to an increase risk of disease hazards in animal areas.
All surfaces must be maintained on a regular basis. Surfaces of housing facilities including houses, dens, and other
furniture-type fixtures and objects within the facility -must be constructed in a manner and made of materials that
allow them to be readily cleaned and sanitized, or removed or replaced when worn or soiled.
To be corrected by May 1, 2017
TRA site: Alameda St., Los Angeles
This inspection and exit interview were conducted with the facility representative."
2292d487222a63a7,3.8,,False,EXERCISE FOR DOGS.,"There was no formal written exercise plan for the dogs in place and made available for review at time of this
inspection. Exhibitors must develop, document, and follow an appropriate plan to provide dogs with the opportunity
for exercise and the plan must be approved by the attending veterinarian. The plan must include written standard
procedures to be followed in providing the opportunity for exercise. The plan must be made available to APHIS
upon request.
Correct by 11-15-2017.
This inspection and exit interview were conducted with the facility owner."
ff630860b38688d3,2.40(b)(2),,False,ATTENDING VETERINARIAN AND ADEQUATE VETERINARY CARE (DEALERS AND EXHIBITORS).,"Two of the dogs inspected at this facility need to be seen by the attending veterinarian for an evaluation and
treatment for their dental condition. Casey a female, poodle has a heavy buildup of brownish-grey dental tartar on
most of her teeth with slightly reddened and recessed gums. There was an odor coming from the mouth with
increased salivation. BomBom, a male, poodle has a heavy buildup of brownish-grey dental tartar on the entire
surface of both sides of the upper and lower cheek teeth as well as the upper portions of both upper canine teeth.
The gums are also slightly reddened with gum recession of both upper sides of the mouth.
Dental problems can cause pain and distress, can lead to inadequate nutrition and potentially affect the overall
health of the animal. All dogs with a heavy buildup of tartar or teeth and gum issues must be evaluated by a
licensed veterinarian for a diagnosis of the problem and to develop an effective treatment plan which must be
followed by the licensee. The licensee must ensure that all dogs receive adequate veterinary care at all times.
Correct by 01/15/2019"
ff630860b38688d3,3.6(c)(1)(iii),,False,PRIMARY ENCLOSURES.,"At the time of inspection the following dogs: Spangle(black, male poodle), Gomer(white, male poodle), Jungle(white,
male poodle), Reyna (black, female poodle), and Chabucca(black, female poodle) were individually housed in
enclosures which did not allow them to have at least 6 inches above their heads while in a normal standing position.
This additional space is required to provide the dogs room for normal postural movements within their enclosures.
The licensee must ensure that the interior height of each primary enclosure is at least 6 inches higher than the head
of the tallest dog in the enclosure when it is in a normal standing position.
Correct by 01/15/2019
This inspection and exit briefing were conducted with a facility representative.
Location: Las Vegas, NV"
