hash_id,code,kind,repeat,desc,narrative
33135b9be86594cb,2.38(f)(1),,False,Miscellaneous.,"On March 24, 2023, an enrichment technician placed a hammock in an enclosure of a cynomolgus macaque. The
technician sectioned off the non-human primate in a single quadrant to safely place the hammock. Once the hammock
was installed, the cage door was closed, locked and the macaque was allowed access to all four quadrants of the
enclosure. The technician left one lock off the front door of the enclosure. The cynomolgus macaque was able to open the
front door and climb out of the enclosure
.
The enrichment technician exited the room and called the facility manager and behaviorist for assistance. The behaviorist
was able to put treats into the enclosure and the macaque returned to the enclosure. The enclosure door was secured
and locked. According to IACUC documents, no injuries were observed on the cynomolgus macaque.
Improper handling can result in animal escapes. Handling of all animals shall be done as expeditiously and carefully as
possible in a manner that does not cause trauma, overheating, excessive cooling, behavioral stress, physical harm, or
unnecessary discomfort.
Corrected before the time of inspection through retraining of the enrichment technician.
This inspection was conducted from June 04, 2024 to June 05, 2024.
This inspection and exit interview were conducted with facility representatives.
n"
f7f04b1de48910af,2.33(b)(4),,False,ATTENDING VETERINARIAN AND ADEQUATE VETERINARY CARE.,"There was an incident identified by the number 2015-11 which took place during the month of December 2015.
The attending veterinarian (AV) inspected a rabbit for a post surgical procedure in which the skin edges were not
apposed. The attending veterinarian gave specific written instructions to treat it as an open wound and let it heal by
2nd intention.
Research personnel decided to anesthetize the animal, debride the wound, and close the open wound without
consulting the AV.
The next day the rabbit was found dead and there was no peri-operative monitoring documentation indicating that
the rabbit had recovered from anesthesia.
Each research facility shall establish and maintain programs of adequate veterinary care that include guidance to
research personnel involved in the care and use of animals regarding handling, immobilization, anesthesia,
analgesia, tranquilization, and euthanasia, etc.
The facility has corrected this issue by providing operative and recovery documentation training and provided a
copy of the IACUC policy for veterinary medical care and best practices."
f7f04b1de48910af,3.75(c)(1),,False,"HOUSING FACILITIES, GENERAL.","Some plastic toys/objects provided to NHP for enrichment were noticeable worn and with chewed edges.
The surfaces of housing facilities--including furniture-type fixtures or objects within the facility-must be made of
materials that allow them to be readily cleaned and sanitized, or removed or replaced when worn.
In order to avoid animals from ingesting plastic particles and to properly clean and sanitize toys/object, these should
be replaced when worn.
To be corrected by 6-30-2016.
An exit interview was conducted with facility representatives."
dd77b186228ae7dd,2.38(f)(1),,False,MISCELLANEOUS.,"Handling
According to facility documentation, two NHP(cid:25)s, one in June 2013 and one in August 2013, were injured during
handling. The incidents occurred during removal from their enclosures, and each animal sustained a limb injury. In
each instance, the injury was recognized by faciliy personnel and the condition of the NHP was assessed.
Measures were taken to relieve the animals of any pain and distress.
Per this Section of the Regulations, animals should be handled as expeditiously as possible in a manner that does
not cause trauma, behavioral stress, physical harm, or unnecessary discomfort to ensure the health and well-being
of the animal.
In response to this incident and to prevent any future incidents, the institution took corrective actions including but
not limited to retraining of the staff on proper handling techniques, as well as additional observation and assessment
by management of the staff performing animal handling. There have not been any additional incidents since the
corrective actions were implemented.
The institution has taken appropriate corrective measures to address this item.
This inspection was conducted at the West Point, PA site on June 17 - 20, 2014. An exit briefing was conducted on
June 20, 2014 with the facility representatives and a copy of the inspection report was left at the facility."
2880f50128bba16e,2.38(f)(1),,False,MISCELLANEOUS.,"According to facility records, November 12, 2014, while performing a routine procedure, personnel discovered that a
female, cynomolgus monkey had sustained injury to her right forelimb. Her condition was assessed and measures
were taken to relieve any pain and/or distress. Upon being notified of the animal(cid:25)s condition, the veterinary staff
conducted an investigation. It could not be clearly determined exactly how she got injured. Based on a review of the
facility(cid:25)s records, the animal was recently handled on 3 November 2014 for routine procedures and 11 November
2014 for enclosure changes.
As per 2.38 (f) (1), handling of all animals shall be done as expeditiously and carefully as possible in a manner that
does not cause trauma, behavioral stress, physical harm, or unnecessary discomfort.
The research facility acted to address this item by conducting an investigation and further implementing appropriate
corrective actions to prevent any future incidents. There have not been any additional incidents since the corrective
actions were implemented."
2880f50128bba16e,3.80(a)(1),,False,PRIMARY ENCLOSURES.,"According to facility records, September 1, 2015, personnel discovered a male, cynomolgus monkey outside of his
primary enclosure. The animal was recaptured and evaluated by veterinary staff. He sustained injuries on the third
and fourth digits on his left foot and received immediate veterinary care. At the time of inspection, the animal did not
appear to be in any pain or distress.
Upon being notified of the escape of the monkey, the veterinary staff immediately conducted an investigation. All the
proper procedures had been followed by personnel. It could not be determined exactly how the animal was able to
escape from his enclosure.
As per section 3.80 (a) (2) (iii), primary enclosures must be constructed and maintained so that they contain the
nonhuman primates securely and prevent accidental opening of the enclosure, including opening by the animal.
The research facility acted to address this item by conducting an investigation and implementing appropriate
corrective actions to prevent any future incidents.
The facility self-reported both incidents to USDA.
This inspection was conducted at the West Point, PA site from September 8-11, 2015.
The exit interview was conducted with facility representatives.
Note: A corrected copy of this inspection report was hand delivered to the facility on July 19, 2016. Registrant
elected not to sign the inspection report, but acknowledged receipt by signing USPS Return Receipt (PS Form
3811) # 7015 1520 0000 3623 8795."
f6f6e68dd08e1b28,3.80(a)(2)(iii),Critical,False,Primary enclosures.,"On November 4, 2021, a rhesus macaque sustained severe injuries from another rhesus macaque in an adjoining
enclosure. According to facility documents, an Animal Care Technician identified the injured macaque during routine
husbandry duties. The Animal Care Technician immediately notified the LAR Veterinarian. Due to the nature of the
injures, the macaque was provided veterinary care by the LAR Veterinarian.
At the time of evaluating the incident, facility personnel noted that the chain used to secure the divider separating the
enclosures was no longer in place and the lock used to secure the chain was open. Additionally, further evaluation in the
incident noted that a cage change had been done the day prior. Primary enclosures must be constructed and maintained
to prevent accidental opening of any part of the enclosure to protect non-human primates from injury.
The facility had implemented corrective actions before the time of inspection"
f6f6e68dd08e1b28,3.82(b),,False,Feeding.,"On May 28, 2022, a room of 52 rhesus macaques were not fed. On May 29, 2022, it was discovered by Animal Care staff
that this room of macaques did not receive their ration of monkey biscuits the day before and the animals were
immediately fed. The Veterinarian reviewed and observed the rhesus macaques on May 30th and determined that all the
macaques were in good health.
Non-human primates must be fed at least once each day to meet their normal daily nutritional requirements and to
maintain their overall health.
The facility had implemented corrective actions before the time of inspection.
This inspection and exit interview were conducted with facility representatives.
This inspection was conducted August 17, 2022 to August 18, 2022.
Additional Inspectors:
GLORIA MCFADDEN, VETERINARY MEDICAL OFFICER n"
1055ee594ecaa292,2.31(d)(8),,False,Institutional Animal Care and Use Committee (IACUC).,"Two non-human primates (NHPs) were transferred from an IACAC approved imaging study protocol to a holding protocol.
After the transfer to the holding protocol both NHPs were used by the Principal Investigator (PI) on the imaging study
protocol. On 03-Aug-2022 the PI was asked by the LAR veterinary associate to stop using NHP A under the imaging
Protocol after it was used two times. This non-compliance was recognized again by the LAR veterinary associate on 08-
Nov-2022 with another NPH (NPH B). This non-compliance was recognized again by the LAR veterinary associate on
08-Nov-2022, as the PI had also used NPH B two times under the imaging protocol after it had been transferred to a
holding protocol.
Proposed activities and proposed significant changes in ongoing activities that have been approved by the IACUC may be
subject to further appropriate review and approval by officials of the research facility. However, those officials may not
approve an activity involving the care and use of animals if it has not been approved by the IACUC.
The facility implemented corrective actions before the time of inspection."
1055ee594ecaa292,2.38(f)(1),Critical,False,Miscellaneous.,"Following a routine cage change on December 14th, 2022, a cage of two guinea pigs was placed on a flat bed containing
dirty cages. After the cage change process was complete, the animal care technician rolled the flat bed with the two
guinea pigs into the autoclave.
Handling of all animals shall be done as expeditiously and carefully as possible in a manner that does not cause trauma,
overheating, excessive cooling, behavioral stress, physical harm, or unnecessary discomfort.
The facility implemented corrective actions before the time of inspection.
This inspection and exit interview were conducted with the facility representatives.
This inspection was conducted 02/06/2023 to 02/09/2023.
Additional Inspectors:
GLORIA MCFADDEN, VETERINARY MEDICAL OFFICEREnd Section"
d1c6dc8cbef8cdf8,2.33(b)(2),,False,ATTENDING VETERINARIAN AND ADEQUATE VETERINARY CARE.,"Several of the animals in the holding pen had multiple various sized areas of circular hair loss lesions on their face,
neck and/or body regions. There was no indication or documentation that these areas of hair loss had been
identified, or that the veterinarian had been notified. The facility must use appropriate method to prevent, control,
diagnosis, and treat diseases on all animals at the facility. The facility called the veterinarian during the inspection."
d1c6dc8cbef8cdf8,2.33(b)(3),,False,ATTENDING VETERINARIAN AND ADEQUATE VETERINARY CARE.,"The daily observation forms at the facility are incomplete and there is no indication the SOPs are being followed.
The standard operating procedures state animals will be brushed and receive hydrotherapy. There was no
indication or documentation that these activities were conducted. There is minimal to no documentation of
treatments or records that the veterinarian was notified when issues such as coughing, diarrhea, hair loss, eye
issues or decreased appetite were noted during daily observations. Following SOPs and providing frequent and
direct communication with the veterinarian is important for the health and well-being of the animals. The facility must
document treatments and have a mechanism of direct and frequent communication with their veterinarian to ensure
timely and accurate treatments of animals.
Correct by 6-1-2017.
This inspection and exit interview were conducted with facility representative.
Additional Inspectors
Pannill Elizabeth, Veterinary Medical Officer"
7f1edda6d03fc4b3,2.33(b)(3),,False,Attending veterinarian and adequate veterinary care.,"F.A.S.S. AG Guide Ch. 3 pg. 22
Facility records indicate that the 6 deer are not included in routine observations . The deer are housed in a 17 acre
enclosure that consists of thick brush and trees making actual animal observation difficult. Frequent observation on a
routine basis is important to detect illness or conditions that may require veterinary care. A method must be developed to
attempt observe the deer in this enclosure on a daily basis .
CORRECT BY: 9/30/2021"
7f1edda6d03fc4b3,3.125(a),Critical,False,"Facilities, general.","F.A.S.S. AG Guide Ch.3 pg 17
The sheet metal which acts as a wind break on the north side of the Front Pen is deteriorating where it meets the ground
in 2 of the cattle holding areas. The rusted and jagged edges extend approximately 5 “to 10 “from the ground and poses a
risk of injury to the animals lower legs. The metal must be repaired or replaced to prevent injury to the cattle. Facilities
must be maintained in good repair to protect the animals from injury. CORRECT BY : 9/30/2021
Records of an incident which occurred March 13. 2020 which involved stray dogs gaining access to the deer pen were
reviewed. The report states that 2 live pit bull type dogs and 1 deceased dog were found in Pen 2 which houses white
tailed deer along with 2 decomposing deer carcasses . Facility records also indicate that a census showed that there
were no longer 12 deer in Pen 2 and the disposition of the deer is unknown. Stray dogs have gained access to the facility
in the past by digging under the perimeter fence. Currently ,there is no method to prevent predators from digging under
the fence or otherwise gaining access to the animal facility. Stray/feral dogs may severely injury or kill deer or cattle . The
animal facility must be structurally strong to protect the animals from predators to prevent injury.
CORRECT BY : 9/30/2021"
7f1edda6d03fc4b3,3.129,,False,Feeding.,"F.A.S.S. AG Guide Ch.3 pg 21
At time of the inspection , there are bags of cattle mineral and deer feed stored on a pallet near the edge of the open
sided Tractor Barn. An employee did verify that these supplies were currently being fed to the animals. Several bags of
mineral and deer feed have been torn open by stray dogs and scattered mineral and feed from these bags has spilled on
the floor around the feed. Storing feed in an area open to the weather allows for contamination of the feed by pests and
deterioration by weather. The quality of the feed/mineral can quickly deteriorate once the bag is torn. The spilled feed on
the floor serves as an attractant for pests which may contaminate the feed. Supplies of food must be protected from
contamination/deterioration to ensure feed quality .
CORRECT BY : 8/25/2021
This inspection and exit briefing were conducted with the facility director.
End Section"
1fe33f7b62cf4c23,3.131(d),,False,Sanitation.,"F.A.S.S. AG Guide Ch.3 Pg. 23
There is an excessive number of flies on and around the feed bunk and on the ground in the first 2 pens of the Front
Holding Pens. There is wet bedding near the feed and water troughs in these two pens which is serving as a breeding
ground for vermin.
One animal # 81 in Stall 11 ( South Barn -Building # 6 ) has an excessive number of flies on her face. There are fly traps
in this barn but none are located in close proximity to this stall. A safe and effective program for the control of insects,
ectoparasites, and avian and mammalian pests shall be established and maintained.
CORRECT BY : 8/14/2022
This inspection and exit briefing were conducted with facility representatives.
n"
01b1314822223047,2.31(c)(1),,False,Institutional Animal Care and Use Committee (IACUC).,"The facility has not performed a semi annual review of the program of humane care and use of animals since September
2023, 9 months prior to the inspection. The formal review of the program ensures that the IACUC remains fully informed
of the facility's compliance with the stipulations of the Animal Welfare Act. The facility must maintain the semi annual
program review schedule.
Correct at the time of the July 2024 IACUC meeting."
01b1314822223047,2.31(c)(2),,False,Institutional Animal Care and Use Committee (IACUC).,"The IACUC has not performed a semi annual inspection of the facility since September 2023, 9 months prior to this
inspection. The official semi annual inspection ensures the IACUC's oversight and maintains accountability for the
facility's compliance. The facility must ensure that the IACUC performs the semi annual inspections on a routine 6 month
basis.
Correct at the time of the July 2024 IACUC meeting."
01b1314822223047,2.31(c)(3),,False,Institutional Animal Care and Use Committee (IACUC).,"The IACUC has not submitted a signed semi annual report to the Institutional Official since September 20, 2023, 9
months prior to this inspection. The report formally details the IACUC's evaluation of the facility and animal care and use
program to ensure that the Institutional Official is aware of any deficiencies and plans for corrections. The facility must
ensure that the semi annual reports are prepared and delivered on a semi annual basis.
Correct following the planned IACUC inspection and program review in July, 2024."
01b1314822223047,2.31(d)(1),,False,Institutional Animal Care and Use Committee (IACUC).,"8 pigs on animal care and use protocol XXX02 underwent skin biopsy according to an IACUC approved standard
operating procedure, but the approved animal care and use protocol the animals were enrolled on did not include skin
biopsy procedures or a search for alternatives to the procedure. All research activities involving animals must be reviewed
and approved by the IACUC before being conducted. The facility must ensure that only procedures included on an
approved animal care and use protocol are performed.
The facility corrected this deficiency immediately following the inspection as reported to the inspector on May 29,204.
This inspection and exit interview were conducted with the facility representative.
n"
a3214aa84442676b,2.31(c)(3),,False,INSTITUTIONAL ANIMAL CARE AND USE COMMITTEE (IACUC).,"The November and May 2013 IACUC semi-annual reports to the Institutional Officer (IO) each identify minor facility
deficiencies. These reports do not contain a reasonable and specific plan and schedule with dates for correcting
each deficiency. The IO, as the legal representative for the research facility, should be informed of the status and
plan to correct deficiencies to ensure they are addressed in a timely manner.
To be corrected from this day forward"
a3214aa84442676b,2.31(e)(2),,False,INSTITUTIONAL ANIMAL CARE AND USE COMMITTEE (IACUC).,"An IACUC approved protocol does not contain a rationale for the appropriateness of the species used. Protocols
require this rationale in order to prevent the unnecessary use of a species in research. The IACUC must ensure all
principle investigators provide a rationale for the appropriateness of the species used.
To be corrected by August 1, 2014
An exit briefing was conducted with the facility representatives.
."
a55a59616b716a54,2.36(b)(3),,False,Annual report.,"A review of IACUC approved protocol DB01V found that it included housing calves in enclosures that limit their movement
to laying and standing. Per the facility’s census, calves were used on this protocol during the 2023 Fiscal Year, however
this exception to the AWA standards was not reported with the annual report submitted to USDA Animal Care. To assure
that the facility is adhering to the standards and regulations under the Act, a summary of all IACUC approved exceptions
must be attached to the annual report. Correct by submitting a revised FY 2023 annual report with a summary of all
exceptions including a brief explanation of the exceptions, as well as the species and number of animals affected. Correct
by April 19, 2024."
a55a59616b716a54,3.130,,False,Watering.,"On June 12, 2023, study related blood draws were challenging on 6 sheep who were found to be mildly dehydrated. Once
presented with water, the sheep drank eagerly and for a prolonged period. Upon closer examination, the facility found the
water line to the animals’ enclosures to be disconnected. This lapse in water access caused the sheep's thirst and
dehydration. Potable water must be provided as often as necessary for the health and comfort of the animals. The sheep
recovered without needing medical treatment and corrective actions were put in place at the time of inspection.
This inspection and exit interview were conducted with facility representatives.
n"
96d5379ab8832e43,2.30(c),,False,Registration.,"No contact with registrant or business was achieved either in person at listed address or by phone or email. Discovered
owner is deceased and apparently business has ceased to operate. No notification of change in status or cancellation
request has been received. Registrants are required to notify Animal Care of changes in operation or to request
cancellation of registration.
To be corrected by 11/1/2023.
n"
