hash_id,code,kind,repeat,desc,narrative
daf6fca3e318c2cd,3.81(c)(2),,False,Environment enhancement to promote psychological well-being.,"The Environment Enhancement Plan does not adequately address the special considerations of an approximately 2-year-
old adult male Squirrel Monkey “Maurice” who was observed engaging in stereotypic behavior. The primate was pacing
along an elevated structure in the enclosure and performing a distinct head twirling motion when it got to the ends of the
structure. The primate was engaging in these behaviors for nearly the entire duration of observations by the inspectors.
The animal was also viewed at different points in the inspection process and was continuing to engage in this behavior.
When the facility representative was asked how this behavior was being treated they stated that this is how Squirrel
Monkeys act and was not implementing any corrective action to curb the behavior.
Failure to establish and follow a written environmental enhancement plan that is reviewed by the attending veterinarian
that includes special considerations for animals that are exhibiting signs of psychological distress can result in the
behaviors worsening, and prolonged discomfort and distress in non-human primates. Certain nonhuman primates must be
provided special attention regarding enhancement of their environment, based on the needs of the individual species in
accordance with the instructions of the attending veterinarian. Correct by ensuring that the written environmental
enhancement plan for all non-human primates contains veterinarian-approved provisions for animals exhibiting signs of
psychological distress and that these provisions are utilized. Correct by 4-April-2025."
daf6fca3e318c2cd,3.87,,False,Primary enclosures used to transport nonhuman primates.,"A nonhuman primate was not being transported in a primary enclosure. APHIS Officials reviewed a social media post
dated 19-April-2024 in which a Squirrel Monkey is being transported in a vehicle freely and not housed in a primary
transport enclosure. A facility representative states that this was their posting and animal. Failure to transport an animal in
a primary enclosure could cause stress, injury, or even death if the vehicle is involved in an accident. Any person subject
to the Animal Welfare regulations must not transport or deliver for transport in commerce a nonhuman primate unless it is
contained in a primary enclosure, such as a compartment, transport cage, carton, or crate. The transport enclosure must
meet all requirements set forth in this subpart. Correct by ensuring nonhuman primates are transported in an adequate
transport enclosure that meets the requirements of this subpart. Correct by 7-March-2025."
daf6fca3e318c2cd,3.154,,False,Environment enhancement to promote psychological well-being.,"The facility was unable to provide a written environmental enhancement plan for the blue and gold macaw at the facility. A
written plan is necessary to ensure that the overall health, well-being, and psychological needs of the birds are being
appropriately met. Failure to follow a species-appropriate environmental enhancement plan can lead to psychological
distress and abnormal behaviors in birds housed at the facility. Facilities that house avian species must develop,
document, and follow a species-appropriate plan for environment enhancement adequate to promote the psychological
well-being of birds. The plan must be in accordance with the currently accepted professional standards as cited in
appropriate professional journals or reference guides, and be approved by the attending veterinarian. The plan must
address social grouping, environmental enrichment, special considerations, restraint devices, and exemptions. The
environmental enhancement plan must be made available to APHIS officials upon request. Correct by 4-April-2025.
This inspection and exit interview were conducted with a Facility Representative.
Additional Inspectors:
Mark Sanderbeck, ANIMAL CARE INSPECTOR n"
85f168b725808f08,3.125(a),,False,"FACILITIES, GENERAL.","Several sharp screws points and sheet metal ends are exposed in the enclosure housing the white-tailed deer. All
of the sharp points and edges are present on an overturned dog house located within the white-tailed deer
enclosure. The sharp points and edges could injury the animal.
Remove, repair, or replace the structure to prevent potential injury to the animal.
To be corrected: 3-28-16
Note: This inspection report was sent by email.
The inspection exit briefing was conducted with the facility owner."
d5bc54f5fccb5b9a,2.126(b),,False,ACCESS AND INSPECTION OF RECORDS AND PROPERTY; SUBMISSION OF ITINERARIES.,"A responsible adult was not available to accompany APHIS Officials during the inspection process at 4:15 pm on
22-Nov-16. The inspector knocked on the facility door, called the contact number for the license holder, and waited
in the driveway for 30 minutes in an attempt to contact the license holder. All attempts were unsuccessful.
A responsible adult shall be available to accompany inspection during business hours."
2cc0b7021ca904e0,2.126(b),,False,ACCESS AND INSPECTION OF RECORDS AND PROPERTY; SUBMISSION OF ITINERARIES.,"A responsible adult was not available to accompany APHIS Officials during the inspection process at 12:30 pm on
30-Jan-18. The inspector called the licensee's phone and knocked at the facility door in attempts to contact the
licensee. Both attempts failed. The inspector waited in the driveway for 30 minutes before leaving.
A responsible person shall be available to accompany inspection."
f30e66953d38902e,2.126(b),,False,ACCESS AND INSPECTION OF RECORDS AND PROPERTY; SUBMISSION OF ITINERARIES.,"A responsible adult was not available to accompany APHIS Officials during the inspection process at 12:15 p.m on
11/23/2015.
Spoke with the owner by phone, he was unable to be present that day for the inspection. Owner gave optimal hours
for availability.
Additional Inspectors
Moore Chad, Animal Care Inspector"
76ca8ff02d3935c9,3.128,,False,SPACE REQUIREMENTS.,"Three flying squirrels were housed in an inappropriate enclosure during the time of inspection. The entire enclosure
measured approximately 20 inches long by 28 inches wide by 4.5 inches tall. There were five divided areas within
the enclosure measuring approximately 5 inches wide by 20 inches long by 4.5 inches tall. The animals were
housed within one of the five divided areas. The animals have been housed in this enclosure for approximately 2
months as per the facility owner. This enclosure does not allow the flying squirrels to express species typical
behaviors.
Place the animals in an enclosure that will allow for species specific behavior to provide for their well-being.
To be corrected: This was corrected between the time of inspection and the exit briefing"
76ca8ff02d3935c9,3.131(d),,False,SANITATION.,"Excessive amounts of rodent feces were present on top three animal transport enclosures within the animal building
during the time of inspection. The facility owner indicated that there aren't currently any provisions to control wild
rodents within the facility. Wild rodents can carry diseases that affect animals.
Establish, implement, and maintain an effective program for the control of wild rodents at the facility.
To be corrected: This was corrected between the time of inspection and the exit briefing
Chad Moore, ACI and Dawn Barksdale, VMO, conducted the inspection exit briefing with the facility owner.
Additional Inspectors
Barksdale Dawn, Veterinary Medical Officer"
10cc7083a12da117,3.26(b),,False,"FACILITIES, INDOOR.","The animal room containing fifteen hamsters has a strong ammonia odor. The high ammonia level was instantly felt
by the inspectors upon entering the facility. Inadequately ventilated animal rooms with high ammonia levels can
cause health problems.
Assure that the animal room is adequately ventilated to provide for the health and well-being of the hamsters.
To be corrected: 3-27-17"
10cc7083a12da117,3.126(b),,False,"FACILITIES, INDOOR.","The animal room containing nineteen degus has a strong ammonia odor. The high ammonia level was instantly felt
by the inspectors upon entering the facility. Inadequately ventilated animal rooms with high ammonia levels can
cause health problems.
Assure that the animal room is adequately ventilated to provide for the health and well-being of the degus.
To be corrected: 3-27-17
This inspection and exit interview were conducted with the owner.
Additional Inspectors
Barksdale Dawn, Veterinary Medical Officer"
b0b5f1b936dad1ee,2.40(b)(2),Critical,False,ATTENDING VETERINARIAN AND ADEQUATE VETERINARY CARE (DEALERS AND EXHIBITORS).,"During the inspection four degu pups were discovered dead and were removed by the licensee. The licensee
stated that he had not noticed the four dead degu pups prior to the inspection. He also stated that there were
previous occurrences of degu litters with dead and/or stillborn animals within the previous six months of breeding
the animals. The licensee did not contact the attending veterinarian regarding the previous deaths of degu pups.
Appropriate methods to identify/observe sick, dying, and/or injured animals must be used to ensure proper
diagnoses and treatment of those affected animals in providing adequate veterinary care. A program of adequate
veterinary care must be in place to prevent, control, diagnose, and treat diseases and injuries for the health and well
being of the animals housed in the facility. Ensure that all employees are properly trained to make observations and
report any and all animals that show signs of sickness and/or injury in addition to contacting the attending
veterinarian regarding the proper care of the animals.
Correct by: April 7, 2018
Additional Inspectors
Moore Chad, Animal Care Inspector"
6b54f3378cb33f4b,2.126(b),,False,ACCESS AND INSPECTION OF RECORDS AND PROPERTY; SUBMISSION OF ITINERARIES.,"A responsible adult was not available to accompany APHIS Officials during the inspection process at 10:15 am on
09-AUG-18.
Additional Inspectors
Moore Chad, Animal Care Inspector"
7aa92129a2279e55,2.40(b)(2),,True,ATTENDING VETERINARIAN AND ADEQUATE VETERINARY CARE (DEALERS AND EXHIBITORS).,"During the inspection a degu was found to have an approximately 2.5 cm in diameter lesion in the middle of its
back. Based on the appearance of the lesion, the injury occurred more than a day ago. The licensee indicated that
he had not noticed the lesion prior to the inspection and had not been in contact with the attending veterinarian
regarding the injury. Appropriate methods to identify/observe sick, dying, and/or injured animals must be used to
ensure proper diagnoses and treatment of those affected animals in providing adequate veterinary care. A program
of adequate veterinary care must be in place to prevent, control, diagnose, and treat diseases and injuries for the
health and well being of the animals housed in the facility. Ensure that all employees are properly trained to make
observations and report any and all animals that show signs of sickness and/or injury in addition to contacting the
attending veterinarian regarding the proper care of the animals.
Additional Inspectors
Moore Chad, Animal Care Inspector"
e888db9246a80a48,2.126(b),,False,ACCESS AND INSPECTION OF RECORDS AND PROPERTY; SUBMISSION OF ITINERARIES.,"A responsible adult was not available to accompany APHIS Officials during the inspection process at 09:30 a.m. on
31-JUL-19.
Called and spoke to the owner who was unable to accompany inspectors due to previous commitment.
Additional Inspectors
Moore Chad, Animal Care Inspector"
dfc7002b6741cfa4,3.31(c),,False,SANITATION.,"Pest control.
The pest control program is not effectively controlling the loose crickets at the facility. Dozens of crickets are loose
in the facility mammal room. They are present on the floors, walls, shelves, and even in the animal enclosures. No
fewer than six crickets were observed in the guinea pig food storage bin when the employee lifted the lid for
inspection. The facility has glue traps deployed in an effort to control the crickets, however; they are not effectively
controlling the population.
Establish, implement, and maintain a program to effectively control the cricket population at the facility.
To be corrected: 11-10-14
Note: The inspection exit briefing was conducted with the facility secretary."
6f34ac9e0876da52,2.40(b)(2),Direct,False,ATTENDING VETERINARIAN AND ADEQUATE VETERINARY CARE (DEALERS AND EXHIBITORS).,"A white hamster's lower incisors are growing back into its face. The extremely long incisors are contacting and
penetrating the skin below the left side of its nose. The nose and surrounding skin is reddened. There is discharge
present on the area where the incisors are contacting and penetrating the skin. Facility staff observed the hamster’s
condition, but didn't notify the veterinarian. Veterinary care issues left untreated can cause pain and discomfort.
Additionally, five hamsters sharing an enclosure had varying degrees of fur loss. The three white hamsters and two
brown hamsters had fur loss ranging from mild to severe. The small brown hamster had the most severe fur loss.
This hamster was partially or completely missing fur on the majority of its body. The other hamsters had patches of
partial and complete fur loss. Facility staff observed the hamsters' conditions, but didn't notify the veterinarian. Fur
loss can be the result of underlying veterinary care issues.
Notify the veterinarian of the hamsters' conditions. Follow through with all prescribed treatments and/or instructions.
To be corrected: All of the affected hamsters were taken to the veterinarian between the time of inspection and the
exit briefing.
This inspection and exit interview were conducted with the secretary."
7fcad1cac6642122,3.31(b),,False,Sanitation.,"Accumulations of rodent feces are present in various areas of the mammal room and reptile room (containing two empty
hedgehog enclosures). These areas include the floor in the corner of the room where empty transport containers are
stored, under the sealed animal food containers, and on the shelves, between the large plastic animal enclosures. Rodent
feces can harbor diseases. Clean the feces from these areas.
Correct by: 1-26-22"
7fcad1cac6642122,3.31(c),,False,Sanitation.,"The presence of rodents was apparent as accumulations of rodent feces were present in various areas of the mammal
room and reptile room (containing two empty hedgehog enclosures). These areas include the floor in the corner of the
room where empty transport containers are stored, under the sealed animal food containers, and on the shelves, between
the large plastic animal enclosures. The facility has a rodent control program in place, but it is not effectively controlling
the population of wild rodents. Rodents can carry diseases that affect other animals. Establish an maintain an effective
rodent control program.
Correct by: 2-9-22
This inspection and exit interview were conducted with the facility representative.
End Section"
0215adbfa31ec44a,3.137(a)(2),,False,PRIMARY ENCLOSURES USED TO TRANSPORT LIVE ANIMALS.,"At least four holes were present in the expanded metal sheets over the windows in the compartments of the primary
animal transport trailer (South Carolina plate #PV21191). The holes where this metal has been cut or broken leave
sharp edges, most of which are bent outward away from the animal compartments. Sharp protrusions in the
compartments pose a risk of injury to animals contained therein, especially during times of transport. Licensee must
ensure that no sharp edges are present in the primary transport enclosures that pose a risk of injury to the animals.
Correct by: September 15, 2014.
Inspected at the York Fair, York, PA.
Exit briefing conducted with owner.
Additional Inspectors
Campitelli D.V.M Kathryn, Veterinary Medical Officer"
d2e33e5ec5dcbc03,2.40(b)(2),,False,ATTENDING VETERINARIAN AND ADEQUATE VETERINARY CARE (DEALERS AND EXHIBITORS).,"The oldest zebra on the property, a male named Zillion, has overgrown hooves. The right front hoof is long and
sloping slightly upward. One brown and white female goat has slightly overgrown claws on her right front and rear
feet. The outer claws are long and starting to curl inward. Overgrown hooves can result in foot damage and
lameness. These animals need to have their feet trimmed to prevent potential problems. To be corrected by
5-23-15."
d2e33e5ec5dcbc03,3.75(a),,False,"HOUSING FACILITIES, GENERAL.","Two male baboons are housed in a chain link outdoor enclosure with an attached sheltered enclosure. They have
destroyed a plank perch in the enclosure leaving 5 loose boards (possibly with nails) on the ground. A small metal
chain which held a round toy swing from the chain link ceiling is hanging loosely from the toy posing a potential
hanging hazard. All structures within non-human primate housing must be designed and constructed so that they
are structurally sound and kept in good repair to prevent potential injury of the animals. These broken structures
need to be repaired or replaced. To be corrected by 5-1-15.
Licensee was not present as both units are in travel status.
Inspection conducted of animals left at farm.
Exit briefing conducted with facility representative."
95e595cb509a900e,3.78(d),,False,OUTDOOR HOUSING FACILITIES.,"The ring tail lemurs had a baby 3 months ago and when the traveling unit came back home, these three animals
were moved into a different enclosure because the baby could potentially leave their original home enclosure. This
enclosure is only separated from the stockade perimeter fence by a few inches. Primate enclosures need to be
surrounded by a 6 foot perimeter fence that is at least 3 feet away from the enclosure fence. This enclosure or the
lemurs need to be moved so that they have the additional protection of a perimeter fence.
To be corrected by 6-26-15.
Exit briefing conducted with licensees."
c527aa4e2a450332,2.131(c)(1),,False,HANDLING OF ANIMALS.,"On October 9th, 2015, a juvenile Lemur escaped from its enclosure while the public was in the viewing area of the
exhibit at the Perry County Fair in GA.. The Lemur bit two bystanders before being captured and returned to its
enclosure. Due care was not taken to ensure the safety of the public and the animal. During public exhibition, any
animal must be handled so there is minimal risk of harm to the animal and to the public. Corrected immediately.
."
c527aa4e2a450332,3.85,,False,EMPLOYEES.,"A juvenile Lemur escaped its enclosure at the Perry Georgia County Fair on October 9th, 2015. Upon escaping the
Lemur bit two onlookers at the exhibit. The employee in charge of the exhibit at that time, entered the exhibit with
the Lemurs while the public was in the viewing area. Failing to secure the enclosure door securely behind him, the
employee allowed the juvenile Lemur to escape creating mayhem for the public and frightening the Lemur. Two
individuals from the public were bitten while trying to help contain the animal. The enclosure door should have not
been opened with the public in the exhibit. The employees who provide husbandry practices and care, or handle
nonhuman primates, must be trained and supervised by an individual who has the knowledge, background, and
experience in proper husbandry and care of nonhuman primates to supervise others. The employer must be certain
that the supervisor can perform to these standards. The employee has been relieved of his position. Corrected at
the time of the incident.
This inspection and exit interview was conducted by Brenda Pietrosante, ACI, GA. State Veterinarian, GA. DNR,
and GA. Center for Disease Specialist, with the facility owner."
918ef6f49d6301c5,2.75(b)(1),,False,RECORDS: DEALERS AND EXHIBITORS.,"The only acquisition record available for review was for 1 llama. There were no other acquisition records that were
with the licensee.
Acquisition records for all mammals that are present shall be readily available for review by any APHIS official.
Correct by March 16, 2016"
918ef6f49d6301c5,2.131(b)(1),,False,HANDLING OF ANIMALS.,"A male goat is leashed within his enclosure because he has had a history of jumping over the enclosure.
This leash poses a risk of entrapment and does not minimize trauma, behavioral stress, physical harm, or
unnecessary discomfort.
The enclosure shall be designed so that escape is not possible or otherwise modified to ensure the well-being of
this goat.
Correct by March 16, 2016"
918ef6f49d6301c5,3.127,,False,"FACILITIES, OUTDOOR.","One of the camels was tethered to a stake and had no protection from sunlight or inclement weather.
All animals shall have sufficient shade & protection from inclement weather to prevent discomfort or overheating.
Correct by March 11, 2016"
918ef6f49d6301c5,3.128,,False,SPACE REQUIREMENTS.,"The camel that is tethered to a stake outside the tent cannot make normal postural adjustments. The tether is too
short to allow this animal to lie down & turn around comfortably.
This animal shall have a sufficient amount of space to make normal postural adjustments with adequate freedom of
movement.
Correct by March 11, 2016
The exit interview was conducted with the manager.
Inspection was performed at the Central Florida Fair, Orlando, FL"
fbb7658b94704e89,2.75(b)(1),,True,RECORDS: DEALERS AND EXHIBITORS.,"Several animals have been born at the home site and are now in travel status with this unit. The acquisition records
for the births of the zebu, zebra, water buffalo, Scottish Hylander, and camel are not recorded. All acquisition
records need to be kept up to date."
fbb7658b94704e89,3.129(b),,False,FEEDING.,"Carrots are being sliced to sell to the public for feeding. The metal carrot slicer is bolted onto a table which is dirty
and the surface of the metal push plate for the carrot slicer is grimy. Grease could also be felt on the slicer which is
WD 40. This is not a food grade lubricant and should not be used to oil this device. Some of the sliced carrots are
in a white bucket and old carrot shreds are at the bottom of the bucket as they were not dumped before refilling.
All utensils, receptacles, and preparation surfaces used to prepare food need to be kept clean and sanitary.
To be corrected by 5-18-16.
Exit interview conducted with employee representative.
Inspection conducted at Heritage Park at Simpsonville, SC park."
a2198bbf42b52dbf,3.150(a),,False,"Facilities, general.","One nest box within the Macaw Aviary is in need of repairs. The wooden nest box had sharp edges and points along the
front opening, with multiple screws exposed and protruding below this area. Compromised structural integrity within
primary enclosures can provide an opportunity for entrapment or injury to the animals contained therein. Housing facilities
shall be structurally sound and shall be maintained in good repair to protect the birds from injury and securely contain
them.
Correct by July 25, 2024."
a2198bbf42b52dbf,2.75(b)(1),,False,Records: Dealers and exhibitors.,"The facility did not have complete acquisition records. Required information was missing for one Eland, one Bison, and
one Yak. Acquisition and disposition records, including offspring born at the facility and all records of disposition, are
necessary to accurately track and identify animals being used in regulated activities, as well as aid in the detection of
movement of animals upon relocation to a new site.
The facility shall make, keep and maintain records that fully and correctly include all the required acquisition and
disposition information, including: the name and address of the person from whom the animals were acquired, the USDA
license number of the person if licensed or the vehicle license number and state and driver’s license number and state if
not licensed, the name and address of the person to whom an animal was given/sold, the date of acquisition or
disposition, the species of animal and the number of animals involved.
Correct by July 25, 2024."
a2198bbf42b52dbf,2.131(d)(2),,False,Handling of animals.,"While observing at least seven separate private vehicles moving throughout the drive-through park at the facility during a
full days’ inspection, the inspector could not locate any readily identifiable attendants present during public interactions
with the animals. Though one park ranger was observed once in the drive-through park during the inspection, they were
unable to oversee all of the patrons present during this time. This resulted in unattended periods of public contact and
feeding of the animals housed therein.
The lack of attendants present during times of public contact increases the risk of injury to patrons and/or animals. A
responsible, knowledgeable, and readily identifiable employee or attendant must be present at all times during periods of
public contact.
Correct by July 22, 2024."
