hash_id,code,kind,repeat,desc,narrative
ca1e0ec531d44748,3.101(a)(3),,False,"FACILITIES, GENERAL.","Some defects were observed on the surfaces inside the monk seal pool. The inspector returned to the facility on
3/22/17, when the pool was scheduled to be drained. Upon viewing the drained pool it was clearly evident that some
areas of the wall and floors of the pool have significantly deteriorated. On the wall, there are at least a dozen large
patches measuring up to five inches in diameter or more, where the original surface is missing, and the underlying
concrete has a roughened surface. On the floor, there are at least two areas where the surface has also failed,
including one two foot by one foot rectangle where eighty percent of the original surface is missing, and the
underlying surface is uneven and rough.
Failure to maintain the surfaces in good repair could result in ingestion of materials coming off of the pool walls and
floor, an inability to adequately clean and disinfect the surfaces, roughened pool bottom that could cause abrasions,
especially when the pool is drained, and / or the possibility of contaminants leaching through the unsealed,
deteriorated areas in the pool surface, which could affect water quality. Any of these could be detrimental to the
health and well-being of the animals.
Whereas the facility has contracted an architect to come up with plans for improvements to this exhibit, there is
currently no documented timeline for performing maintenance on the pool surfaces.
All surfaces in a marine mammal primary enclosure must be constructed of durable, nontoxic materials that facilitate
cleaning, and disinfection in order to maintain the desired water quality. All surfaces must be maintained in good
repair as part of a regular, ongoing maintenance program.
To be corrected by November 20, 2017.
This inspection was conducted on 3/20/17 and 3/22/17, and the inspection and exit interview were conducted with
facility representatives."
9edb49fbad6b0a9a,2.131(b)(1),Critical,False,Handling of animals.,"On April 20, 2024, a peregrine falcon was unexpectedly startled during a presentation and escaped from its handler. The
handler had removed the bird from its travel enclosure, and the falcon panicked with a gust of wind and the handler lost
control of the restraint devices. The falcon was not recovered despite efforts to retrieve it. Escaped animals may suffer
physical harm, trauma, and stress. The facility must address handling to ensure animals are handled as expeditiously and
carefully as possible to minimize these risks. Corrective actions made by the facility included re-assessing exhibitions
during high winds and creating procedures for outdoor raptor handling, and searches.
Correct by 06/17/2024
This inspection and exit interview were conducted with Facility Representative.
n"
9805ea9f8e050ed2,2.40(b)(2),,False,ATTENDING VETERINARIAN AND ADEQUATE VETERINARY CARE (DEALERS AND EXHIBITORS).,"One cinnamon colored male Chihuahua that the facility representative estimated at 15 years old (microchip number
086-333-327) has a heavy coating of dark brown matter on his upper teeth. The dog was also missing all of its
bottom teeth. The abnormal buildup of material on the teeth can cause damage to the gum tissue and tooth
structure, be painful, impact the ability of the dog to eat normally and harm the health of the animal. The licensee
must have this animal examined by a veterinarian and appropriate plan administered. The outcome of this
examination must be documented and provided to the inspector upon request. The licensee must ensure that all
animals receive adequate veterinary care at all times.
To be corrected by August 11, 2014.
Exit interview conducted with facility representative at time of inspection."
cdce4529d2d130e8,2.31(c)(7),,False,INSTITUTIONAL ANIMAL CARE AND USE COMMITTEE (IACUC).,"*** Protocol 256: A procedure was performed on a species not specified in the approved animal use protocol. Any
changes to a protocol must be reviewed and approved by the IACUC prior to conducting any activity associated with
the change. An IACUC review of protocol changes is to ensure that animals do not experience unnecessary pain
and distress and to verify that personnel are adequately trained to handle and conduct procedures on a particular
specied. The IACUC must amend the protocol to include goats as a species and/or implement appropriate
procedures to ensure protocol changes are reviewed and approved by the IACUC for all protocol deviations
involving the use of animals.
Correct by May 30, 2014.
NOTE: The goat did not experience any pain or distress as it was a terminal procedure performed under
anesthesia."
cdce4529d2d130e8,2.40(b)(2),,False,ATTENDING VETERINARIAN AND ADEQUATE VETERINARY CARE (DEALERS AND EXHIBITORS).,"***Protocol 229: Rabbits on the study failed to receive a prescribed medical treatment for a day and a half.
Treatment for a medical condition must be adminsiterd as indicated by the atending veterinarian. Personnel must be
trained on the procedures for identifying animals on treatment according to facility standard operating procedures to
ensure the veterinarian's prescribed treatment is administered in a timely manner. Correct by April 18, 2014
An exit briefing was conducted with the facility representatives."
64652b2ceb8aaa37,2.40(b)(2),,False,ATTENDING VETERINARIAN AND ADEQUATE VETERINARY CARE (DEALERS AND EXHIBITORS).,"Expired medications were found as follows:
SPF Clinic: 3 jars of Erythromycin tabs-exp 5/8/15, 1 vial Vit B inj-exp 7/15, 1 Gentocin spray-exp 7/11, 10 tubes of
Vetropolycin oint-exp 4/15, 1 vial of Aminophyline-exp 6/1/15
Conventional clinic: 1 jar of Erythromycin tabs-exp 5/8/15, 2 bottles of Amoxicillin--exp 1/15, 2 vials Cetazolin-exp
9/14.
Additionally, a vial of Penicillin G inj is currently being used to treat primates BA 74, AD 65, BP 15, & BK 19. When
this was discovered by this inspector during the inspection the veterinarian immedialtey changed the treatment to a
different antibiotic.
Expired medications are considered adulterated, and their use is not an appropriate method to prevent, control,
diagnose, and treat diseases and injuries.
The facility currently has a system for identifying expired medications, but it appears that this system is not entirely
effective. Institute improvements to assure that expired medications are removed and not administered to any
animals.
Correct immediately"
64652b2ceb8aaa37,3.78(d),,False,OUTDOOR HOUSING FACILITIES.,"On June 28, 2015, a person (or persons) entered the facility and facilitated the escape of 11 primates from their
enclosure. Ten of these primates were either captured or returned to their enclosure on their own. One primate is
still missing.
The facility inspected the perimeter fence and did not find any cuts or openings along the fence. An inspection of
the perimeter fence today showed that there was a space between the 2 service gates adjacent to the enclosure
which could be moved a few inches by hand. There was also a space between the bottom of another service gate
and the ground near enclosures 163/164 which also can be moved a few inches by hand. The perimeter fence is
not 6 feet high on the left side of the old feed bunker, and this section shall be raised to at least 6 feet high.
The perimeter fence shall restrict unauthorized persons (and animals) from entering the facility and having contact
with the animals. The perimeter fence shall be at least 6 feet high along its entire length.
Since this incident, the facility has provided additional security measures.
Correct by September 1, 2015
This was a partial inspection. The exit interview was conducted with the attending veterinarian."
a9cb5b67637792b3,2.31(e)(3),,False,INSTITUTIONAL ANIMAL CARE AND USE COMMITTEE (IACUC).,"Protocol # A1500116 & 9040115 do not contain complete descriptions of the proposed use of the animals, nor does
it contain the actual numbers of animals that will be studied. These activities involving primates are reportedly a
continuation of other PI's terminated work but there is no mention of this in either protocol.
All protocols must contain a complete description of the proposed use of animals and the rational for such use. If a
protocol is an exact continuation of previous work, that shall be so stated in the protocol and available for review
during an Animal Welfare inspection. Any deviations to those previous protocols shall also be completely
described.
Correct by July 24, 2016"
a9cb5b67637792b3,2.33(b)(3),,False,ATTENDING VETERINARIAN AND ADEQUATE VETERINARY CARE.,"Primate 8Q6 was observed to have an opacity in the right eye. The vet techs indicated that he was born with large
eyes and has been this way since birth. They are continuously observing this condition. This condition, however,
was never reported to the attending veterinarian for examination, and has never received any veterinary care. The
veterinarian is the person who is qualified to assess the animal's health and well-being, and is the one who would
determine if an animal is suffering, or is experiencing pain &/or distress. He is also the one who would decide
whether no treatment, treatment, or euthanasia is appropriate.
A mechanism of direct and communication is required so that timely information on problems with animal health and
well-being is conveyed to the attending veterinarian so that he may determine if this animal is in pain, distress or
suffering; and to decide whether veterinary examination, care, or euthanasia is appropriate.
Correct immediately"
a9cb5b67637792b3,3.78(d),,False,OUTDOOR HOUSING FACILITIES.,"Recently a mainland operator is offering jet ski tours to the public which stops a few hundred feet offshore from the
island. The participants get off of their jet skis and then snorkel in the shallow waters. There is photographic
evidence that some of these participants actually gained access onto the island.
The primates can become stressed due to observing new people. This stress reaction can possible alter the
behavioral research that is being conducted. There is also a health risk to the public if the primates should attack,
bite, scratch, defecate or urinate on them since they can be on the ground, overhead in the trees, or in the water. It
is also known that some of the primates on this island are Herpes positive which also poses an additional health risk
to the jet ski participants.
The registrant has hired security to patrol these particular areas, but the security leaves the island mid day and
before these jet ski operations end for the day.
Additional security (or other) measures shall be established to ensure that the unauthorized persons cannot get
close or gain access to the island and make direct or indirect contact with the primates, so as to ensure both the
safety of the primates as well as the public. This can be accomplished (but not limited to) additional security,
erection of a fence or other type of barrier, or continuous video surveillance.
Correct by July 31, 2016
The exit interview was conducted on-site with the contact person.
The contact person had to leave before this inspection report could be completed. By mutual agreement, this
inspection report will be E mailed to the contact person."
583da907f167a5c5,2.38(f)(1),,False,MISCELLANEOUS.,"According to the minutes from April 2016, there was an incident on April 15, 2016 in which 4 NHP escape from their
primary enclosure.
Two NHP were captured the same day, one the next day and the other one on July 22.There was no injury to the
animals and they stayed within the perimeter area of the facility.
Handling of all animals shall be done as expeditiously and carefully as possible in a manner that does not cause
behavioral stress, or unnecessary discomfort.
The situation has been corrected by retraining the employees, changing the padlock system by using color coded
padlocks and controlling who has the keys and by having security guards recheck the enclosure padlocks during the
rounds they make around the facility.
This inspection and exit interview were conducted with the facility representative."
c8abc5a5a6d313b6,2.31(e)(3),,False,INSTITUTIONAL ANIMAL CARE AND USE COMMITTEE (IACUC).,"Protocol # A170316 contains a list of various teaching procedures that may be performed on the animals. Several
of these procedures are only described generally in the protocol, and do not contain a complete description of the
work that may be performed.
All protocols must contain a complete description of the proposed use of the animals.
Correct by March 10, 2017
This inspection and exit interview were conducted with the Clinical Veterinarian"
926eb95fd7ae0006,3.75(c)(1)(i),,False,"HOUSING FACILITIES, GENERAL.","The horizontal tube at the bottom of several gates in the primate enclosures (SPF section), had flaky rust and
jagged edges.
In order to prevent injury to the primates if their fingers come in contact with the rusted jagged edges and to
preserve the structural strength of the enclosure, facilities must be kept in good repair.
To be corrected by 7-1-2017.
This inspection and exit interview were conducted with the facility representative."
f470f9c2b7536bfb,2.38(f)(1),Critical,False,Miscellaneous.,"The lack of adequate husbandry and animal care practices animal during the University’s Union incident during February
17th and 18th, 2022 was noncompliant with the handling of animals under the regulations of the Animal Welfare Act
(AWA); four nonhuman primates died, and one nonhuman primate had escaped when personnel/normalcy returned to the
premises. According to facility reports to the IACUC, on February 17th, a hospitalized animal was found dead in her
treatment cage approximately at 11:00am; five hours overdue for medical treatment (staff normally starts at 6:00am). A
report to the IACUC on February 18th stated that another two animals were found dead in their respective enclosures;
carcasses not removed from enclosures until late (cause of deaths unknown). Early on February 17th, an animal was
identified as injured by his conspecifics, but was not removed from its enclosure or treated until after 3:00pm; facility
veterinarians humanly euthanized the animal on February 19th due to poor prognosis. Also early on February 17th, an
animal escaped its enclosure, and was observed attacking other animals from other enclosures; the animal was not
trapped until after 3:00pm. Failure to handle animals appropriately can lead to deteriorating health and welfare, including
escapes and death. The facility shall be able to handle animals at all times expeditiously, carefully, and in a manner that
does not cause trauma, behavioral stress, or physical harm to members of the nonhuman primate colony, by providing the
AWA-required husbandry and animal care practices.
To be completed by: July 23, 2022"
f470f9c2b7536bfb,3.85,Critical,False,Employees.,"Due to the University's Union incident on February 17th and 18th, 2022, the entrance to the Sabana Seca site premises
was blocked, preventing access of required/essential personnel to the facility. Only up to four out of the total 20 qualified
facility personnel were able to enter the facility during the two days of the incident, which resulted in the delivery of
inadequate husbandry and animal care services to a colony of over 2,300 nonhuman primates. As a result, four
nonhuman primates died; two found dead in their enclosures, one found dead in the facility's hospital, and one died by
humane euthanasia two days after due to complications of traumatic injuries by conspecifics. Any facility subject to the
Animal Welfare Act regulations must have enough employees to carry out the level of husbandry practices and care at all
times. The lacking in number and adequately trained employees can lead to inadequate husbandry and care to
nonhuman primates, posing a risk to their health and welfare. Also, in order to handle nonhuman primates, sufficient
number of employees must be trained and supervised by an individual who has the knowledge, background, and
experience in proper husbandry and care of nonhuman primates to supervise others. The research facility must be
certain that the supervisor can perform to these standards.
To be completed by: August 22, 2022
This inspection and exit interview were conducted with two facility representatives.
n"
dd24dc57e5edba9a,3.84(c),,False,"Cleaning, sanitization, housekeeping, and pest control.","Several metal roof planks from the investigator’s office, and two animal shade platforms were observed to have extensive
corroded sharp points and edges. Buildings and facilities at premises where nonhuman primates congregate and use,
must be kept in good repair, and be free of jagged edges or sharp points in order to protect the animals from traumatic
injuries. To prevent potential injuries to the nonhuman primates in the colony, the facility must repair or replace as all
corroded roof planks on all affected buildings within the premises.
To be completed by: September 25, 2022
This inspection and exit interview were conducted with three facility representatives.
n"
beca3d9ba6d12f0c,2.126(b),,False,ACCESS AND INSPECTION OF RECORDS AND PROPERTY; SUBMISSION OF ITINERARIES.,"A responsible adult was not available to accompany the APHIS Official during the inspection process at 3:45 pm -
4:15 pm on 09/10/2014.
No one responded to knock on door or when I honked the car horn. Left message on voicemail."
7495aac64d82bca6,3.4(b)(4),,False,OUTDOOR HOUSING FACILITIES.,"None of the outdoor shelters contained enough bedding. There was a small amount of shavings in most of the
shelters, but not enough to even cover all of the floor in some of the shelters. The ambient temperature at the time
of the inspection was 41 degrees F, but had gotten down to 33 degrees F the night before. The licensees stated
that they had not added any bedding to the shelters since the previous spring. Inadequate bedding can result in
dogs becoming too cold, which can adversely affect the health of the animals. The licensee must ensure that all
dogs are provided with clean, dry bedding material if the ambient temperature is below 50 degrees F and additional
clean, dry bedding when the temperature is 35 degrees F or lower.
This item must be corrected by November 28, 2018."
7495aac64d82bca6,3.4(b),,False,OUTDOOR HOUSING FACILITIES.,"Three adult German shepherd dogs had inadequate shelter. Two of the dogs were in an enclosure with one shelter
structure that was of inadequate size for both dogs. The other dog had a shelter structure that was too small for the
dog. Inadequate shelter doesn't provide enough protection from the wind and cold, which can affect the health of
the dogs. The licensee must provide shelter structures that allow each dog enough space to sit, stand, and lie in a
normal manner and to turn about freely.
To be corrected by November 30, 2018.
This inspection and exit interview were conducted with the licensee."
e5dff774456d165b,3.2(b),,False,Indoor housing facilities.,"There was inadequate ventilation in the whelping building. The whelping building is a converted reefer trailer with a door
on one end and a small window and air conditioner unit on the other end that was unplugged. Upon entering, there was
an ammonia odor that got stronger as the inspectors progressed towards the back of the trailer. Both inspectors had
burning eyes and one inspector's eyes began to water by the time we got to the end of the trailer. Strong ammonia levels
can lead to respiratory issues and burning and sensitivity in the eyes. Indoor housing facilities must be sufficiently
ventilated at all times to minimize odors and ammonia levels to provide for the health and well-being of the animals.
Correct by 11/4/22 by properly ventilating the kennel building at all times."
e5dff774456d165b,3.6(a)(2)(i),,False,Primary enclosures.,"There were multiple broken wires and sharp points protruding into several kennels containing dogs. Seven enclosures
containing 11 dogs had broken wire flooring or wire ties pointed into the enclosures that the dogs could step on or brush
up against. Two kennels containing 2 dogs had solid aluminum sheeting between 2 adjacent enclosures that had been
bitten, chewed, and pulled up, creating sharp edges. Three kennels containing 4 dogs had metal feeders with wire hooks
protruding into the enclosure, right at eye level next to the food. One of the feeder hooks had a large clump of fur stuck to
it. Sharp points could scratch or cut the skin, feet, or eyes of dogs in the enclosures. Primary enclosures must be
constructed and maintained so that they have no sharp points or edges that could injure the dogs. Correct by 10/30/22 by
ensuring that no primary enclosures contain sharp points."
e5dff774456d165b,3.6(a)(2)(ii),,False,Primary enclosures.,"In the whelping building, 3 separate primary enclosures containing 4 dogs had broken flooring, creating holes large
enough for feet to fall through or become entrapped. The holes ranged from 2"" x 2"" to 2"" x 3"". Wire flooring in disrepair
can cause injury if dogs' feet fall through. Primary enclosures must be constructed and maintained so that they protect the
dogs from injury. Correct by 10/30/22 by repairing the holes in the wire flooring."
e5dff774456d165b,3.8(a),,False,Exercise for dogs.,"In the whelping building, one dog, a dachshund named Black Satin did not have adequate space to exercise. The facility's
exercise plan is to group house dogs or provide individually housed dogs with twice the minimum required floor space.
Black Satin was 20"" long, requiring a minimum of 676 square inches of floor space with additional opportunity for exercise
or doubled (1352 square inches of floor space) for exercise. Black Satin's primary enclosure was 36"" x 36"", providing
1296 square inches, falling short of the exercise requirement. Dogs must be provided with adequate exercise to promote
physical health and mental well-being. Dogs that are housed individually, must be provided twice the minimum space
requirement per the exercise plan. Correct by 10/28/22 by ensuring adequate space for exercise."
e5dff774456d165b,3.11(b)(2),,False,"Cleaning, sanitization, housekeeping, and pest control.","The licensee is not sanitizing primary enclosures in the whelping building at acceptable intervals. The licensee stated that
she sanitizes the enclosures before she moves a new dog into a used enclosure, which occurs when puppies are weaned
and new dogs are brought in before they whelp. She spot cleans daily but is not sanitizing at least every 2 weeks. When
enclosures are not sanitized, dirt, debris, and disease causing organisms can flourish and cause illness. Primary
enclosures must be sanitized at least once every 2 weeks using an appropriate method per the regulations, or more often
as necessary. Correct by sanitizing enclosures at appropriate intervals from this day forward."
e5dff774456d165b,3.13(a)(3),,False,Veterinary care for dogs.,"The program of veterinary care did not list a sampling frequency for heartworms and no medical record existed to
demonstrate that heartworm testing is occurring. Testing is necessary to detect infections of heartworm, which is a
deadly and contagious disease. The program of veterinary care must direct and accurately reflect the prevention,
diagnosis, and treatment of diseases common in kennels, including rabies, parvo, distemper, fleas, intestinal worms,
coccidia, giardia, and heartworm. Correct by 11/30/22 by ensuring sampling and treatment protocols are written and
approved by the attending veterinarian in the program of vet care."
e5dff774456d165b,3.13(b),,False,Veterinary care for dogs.,"There were no medical records available to document the annual exam by the veterinarian. The attending veterinarian
performed his annual visit several months ago and provided a list of dogs needing dentals. No other record exists to
document the findings of the exams. Medicals records are important to track health history of dogs over time and ensure
complete and thorough treatment of medical conditions. Correct by maintaining medical records of all veterinary
encounters from this day forward.
This inspection and exit interview were conducted with the licensee.
Additional Inspectors:
Brianna Waldrop, VETERINARY MEDICAL OFFICER n"
6b8d855e4e8c3e03,2.40(b)(2),,False,Attending veterinarian and adequate veterinary care (dealers and exhibitors).,"Multiple dogs have not been given their prescribed antibiotics after their dental cleanings and extractions. At least 9
bottles of half to nearly full liquid clindamycin were in the medical supply months after they were prescribed. The
prescription labels stated to give until gone and were prescribed between September and December 2022. The licensee
stated that they stopped giving the medications once the dogs started eating again after their dentals. A phone call with
the Attending Veterinarian revealed that he did not authorize stopping the antibiotics. The use of medications such as
antibiotics after surgery can prevent disease such as abscesses and complications can arise when not used as
prescribed. The licensee must maintain adequate veterinary care by using appropriate methods to prevent disease.
Correct from this day forward."
