hash_id,code,kind,repeat,desc,narrative,air_transport_flag,classification_explanation,matched_positive_rules,matched_negative_rules
33774ae6d1041946,2.126(a)(2),,False,ACCESS AND INSPECTION OF RECORDS AND PROPERTY; SUBMISSION OF ITINERARIES.,"Records not available for inspection. Licensee and supervisory personnel not present, and workers had no access
to records. Acquisition / disposition records, written program of veterinary care, and any treatment records must be
available at time of inspection.
CORRECT FOR FUTURE INSPECTIONS",0,No positive rules matched,[],[]
33774ae6d1041946,3.11(c),,False,"CLEANING, SANITIZATION, HOUSEKEEPING, AND PEST CONTROL.","Utility/prep area in lower kennels had several unlabeled spray bottles containing various substances. Unlabeled
bottles can result in accidental misuse of products, which can result in harm to animals. A system must be in place
to ensure substances used around animals are properly labeled and safely used.
CORRECT BY: 5-25-14
Exit interview conducted with facility personnel.",0,No positive rules matched,[],[]
f862d8628093e4db,2.40(a)(1),,False,Attending veterinarian and adequate veterinary care (dealers and exhibitors).,"The last site visit and review of the Program of Veterinary Care, (PVC), by the attending veterinarian was over 1 year ago
(9-16-2022). The Program of Veterinary Care should be reviewed and updated as necessary to accommodate new
animals/species, facility changes, new regulations, and/or changes in husbandry practices.
Each dealer and exhibitor shall employ an attending veterinarian under formal arrangements. In the case of a part-time
attending veterinarian or consultant arrangements, the formal arrangements shall include a written program of veterinary
care and regularly scheduled visits to the premises of the dealer or exhibitor.
Correct by November 2, 2023.",0,No positive rules matched,[],[]
f862d8628093e4db,2.40(b)(2),,False,Attending veterinarian and adequate veterinary care (dealers and exhibitors).,"The following medications were past the labeled expiration date: cephalexin 250 mg - expired in 2021, cephalexin 500mg
expired on 8-21-2023. These medications were intermingled with other products that are currently being used at the
facility and are therefore considered ready for use.
Expired drugs are not an appropriate method to prevent, control, diagnose, and treat diseases and injuries. The licensee
must ensure that all medications used in the facility are not expired, labeled properly in accordance with standard
veterinary practices, and are stored in accordance with manufacturer recommendations.
Correct by November 2, 2023.
This inspection and exit interview were conducted with a facility representative.
n",0,No positive rules matched,[],[]
feacb832b1ebc008,2.126(c),,False,Access and inspection of records and property; submission of itineraries.,"At the time of the inspection, only three of the sixteen dogs listed on the APHIS 7005 Dogs on Hand Form were present at
the facility. The staff representative said that the dogs are kept with other trainers and are not usually present at the
inspection site. No itineraries have been submitted for the other 13 dogs not available for inspection.
Any person who is subject to the Animal Welfare regulations and who intends to exhibit any animal at any location other
than the person’s approved site (including, but not limited to, circuses, traveling educational exhibits, animal acts, and
petting zoos), except for travel that does not extend overnight, shall submit a written itinerary to the Deputy Administrator.
The itinerary shall be received by the Deputy Administrator no fewer than 2 days in advance of any travel and shall
contain complete and accurate information concerning the whereabouts of any animal intended for exhibition at any
location other than the person’s approved site. If the exhibitor accepts an engagement for which travel will begin with less
than 48 hours’ notice, the exhibitor shall immediately contact the Deputy Administrator in writing with the required
information. APHIS expects such situations to occur infrequently, and exhibitors who repeatedly provide less than 48
hours’ notice will, after notice by APHIS, be subject to increased scrutiny under the Act.
Correct by September 10, 2024",0,No positive rules matched,[],[]
feacb832b1ebc008,3.13(a)(3),,False,Veterinary care for dogs.,"At the time of the inspection, it was found that 15/16 dogs had not been vaccinated yearly for Bordatella as required by
the attending veterinarian as written in the program of veterinary care. The last date of Bordatella vaccination was
documented to be on 6-20-2023 for 14 dogs and on 4-19-2023 for one dog. Requirements for preventive care must be
followed as directed by the AV.
Vaccinations for contagious and/or deadly diseases of dogs (including rabies, parvovirus and distemper) and sampling
and treatment of parasites and other pests (including fleas, worms, coccidia, giardia, and heartworm) in accordance with a
schedule approved by the attending veterinarian.
Correct by September 10, 2024",0,No positive rules matched,[],[]
feacb832b1ebc008,3.13(b),,False,Veterinary care for dogs.,"At the time of the inspection, medical record files were only available for 3 of the 16 dogs listed on the dogs on hand
APHIS 7005 form.
Dealers, exhibitors, and research facilities must keep copies of medical records for dogs and make the records available
for APHIS inspection.
These records must include: The identity of the animal, including identifying marks, tattoos, or tags on the animal and the
animal’s breed, sex, and age; Provided, however, that routine husbandry, such as vaccinations, preventive medical
procedures, or treatments, performed on all animals in a group (or herd), may be kept on a single record; If a problem is
identified (such as a disease, injury, or illness), the date and a description of the problem, examination findings, test
results, plan for treatment and care, and treatment procedures performed, when appropriate;
The names of all vaccines and treatments administered and the dates of administration; and the dates and
findings/results of all screening, routine, or other required or recommended tests or examinations.
Correct by September 10, 2024
This inspection and exit interview were conducted with a facility representative.
n",0,No positive rules matched,[],[]
c9028b9ef6cf5b2c,2.126(b),,False,Access and inspection of records and property; submission of itineraries.,"An authorized responsible adult was not available to accompany APHIS Officials during the inspection process at 2:04 pm
on Thursday, April 3rd, 2025. The inspector attempted to contact the licensee by phone and text messages and waited
until 2:38 pm before leaving the premises without receiving reply from licensee. Failure to provide access to the facility,
animals, and records for inspection is a serious violation of the AWA and regulations. Failure to comply may result in
enforcement action.
End Section",0,No positive rules matched,[],[]
9cc24ea7c5caf73a,2.33(a)(1),,False,ATTENDING VETERINARIAN AND ADEQUATE VETERINARY CARE.,"The program of veterinary care provided was incomplete. It did not list veterinary care procedures for all the
regulated species present at the facility within the past year (bushbabies were listed, but not sheep, rabbits, or
cattle). Furthermore, information was not provided about when reglarly scheduled visits by the attending
veterinarian would be made. A vague program of veterinary care can contribute lack of approprate and timely
treatment for ill animals. There were, in addition, no written provisions for emergency care in this document.
Research facilities employing a consulting veterinarian must have a written program of veterinary care listing all
regulated species and documented regularly scheduled visits to the research facility. To be corrected by 2/26/2014.",0,No positive rules matched,[],[]
9cc24ea7c5caf73a,2.33(b)(2),,True,ATTENDING VETERINARIAN AND ADEQUATE VETERINARY CARE.,"During inspection of the bush baby facility several bottles of expired medications were found mixed with unexpired
drugs. This included antibiotics and a topical spray expired for more than 30 days. Expired medications shall not be
used for the treatment of regulated animals as they can cause unintentional illness. Expired medications must be
clearly labeled as expired and separated from current medications, or properly disposed of.",0,No positive rules matched,[],[]
9cc24ea7c5caf73a,3.75(a),,False,"HOUSING FACILITIES, GENERAL.","There were at least two ceiling lights in one of the rooms of the bush baby facility with a coating of black film
material that was peeling off. As one of these lights was located over a corner of a bushbaby cage, pieces of the
black film material could fall off into the cages and cause injury to the animals (ingestion etc.). Housing facilities for
nonhuman primates must be kept inn good repair and must protect the animals from injury. To be corrected by
2/26/2014.
There was an electrical outlet in a room of the bushbaby facility that was missing a cover. As water is often used in
cleaning the facility, this could present a hazard to regulated animals or laboratory staff. Housing facilities for
nonhuman primates must be kept inn good repair and must protect the animals from injury.To be corrected by
3/12/2014.
The exit briefing was conducted with the Director of ORI.
Additional Inspectors
Gaj Gregory, Supervisory Animal Care Specialist",0,No positive rules matched,[],[]
785b8b071c4877ab,2.31(c)(3),,False,Institutional Animal Care and Use Committee (IACUC).,"The semiannual program review from November 2019 and June 2020 noted minor deficiencies regarding the cage
washer. The reports did not contain a schedule with dates for correcting these deficiencies. Deficiencies noted during the
semiannual program review must include a plan and timeframe for correction, in order to ensure the timely and complete
correction of problems identified. Correct on September 25th, 2020, by including reasonable and specific plans and
correction dates for all deficiencies identified during future semiannual program reviews and facility inspections.",0,No positive rules matched,[],[]
785b8b071c4877ab,2.31(c)(2),,False,Institutional Animal Care and Use Committee (IACUC).,"Protocol 15101501, approved on October 25, 2018, states that sheep will be housed for the duration of the protocol at a
facility not owned or operated by the University. This facility was not included in the semiannual facility inspections and
program reviews conducted in November 2019 or June 2020. Inspection of animal housing facilities is important to ensure
animals are housed in facilities that are appropriate, safe, and in compliance with the applicable regulations under the
Animal Welfare Act. Correct on September 25th, 2020, by including all animal housing facilities in future semiannual
program reviews and facility inspections.",0,No positive rules matched,[],[]
785b8b071c4877ab,2.31(e)(2),,False,Institutional Animal Care and Use Committee (IACUC).,"Protocols 15101501, 17101206, and 18022801, did not include a rationale or explanation for the species used. A rationale
is required in order to demonstrate the appropriateness of the species selected for use in research. Correct on September
25th, 2020, by including a rationale for the species of animals to be used in research protocols.",0,No positive rules matched,[],[]
785b8b071c4877ab,2.36(b)(7),,False,Annual report.,"The 2019 annual report submitted by the institutional official to USDA APHIS Animal Care included 0 rabbits and 0 sheep.
The USDA inspection conducted in July 2019 included the observation of two rabbits at the research facility. These
rabbits were not included on the 2019 annual report. Facility representatives stated that these rabbits were used in study
17101206, and should have been reported in column D on the 2019 annual report. Facility representatives reported that in
fiscal year 2019, 4 rabbits were used in total and should have been reported in column D. Facility representatives also
reported that 6 sheep were used in fiscal year 2019 which should have been reported in column D. Correct reporting of
information on the annual report is required so that the public and Congress can have knowledge of the number, type,
and pain category of animals used- or held for use in research. Correct by September 30th, 2020, by submitting a
corrected annual report to USDA APHIS Animal Care.
This inspection and exit interview were conducted with facility representatives.
End Section",0,No positive rules matched,[],[]
76617f76f5d0be65,2.31(c)(3),,True,Institutional Animal Care and Use Committee (IACUC).,"The semiannual program review from November 2020 noted a minor deficiency regarding the cage washer. The report
did not contain a schedule with dates for correcting this deficiency. Deficiencies noted during the semiannual program
review must include a plan and timeframe for correction, in order to ensure the timely and complete correction of
problems identified. Correct by including reasonable and specific plans and correction dates for all deficiencies identified
during future semiannual program reviews and facility inspections.",0,No positive rules matched,[],[]
76617f76f5d0be65,2.31(c)(2),,True,Institutional Animal Care and Use Committee (IACUC).,"Protocol 15101501, which is active and was approved on October 25, 2018, states that sheep will be housed for the
duration of the protocol at a facility not owned or operated by the University. This facility was not included in the
semiannual facility inspection and program review conducted in November 2020. Animals were housed at the off-site
facility in January and February 2021. Inspection of animal housing facilities is important to ensure animals are housed in
facilities that are appropriate, safe, and in compliance with the applicable regulations under the Animal Welfare Act.
Correct by including all animal housing facilities in future semiannual program reviews and facility inspections.
This inspection and exit interview were conducted with facility representatives.
Additional Inspectors:
Gervais Edmonds-Wiggins, VETERINARY MEDICAL OFFICEREnd Section",0,No positive rules matched,[],[]
64a01dc80c47f899,2.36(b),,False,Annual report.,"The facility's annual report for FY 2022 did not accurately report all animals used or held for research. The FY 2022
annual report reported 10 hamsters (all in Column D) and zero rabbits. Review of facility records of animal acquisition and
disposition showed that the facility used 1 rabbit in May 2022 which should have been reported in Column D. Facility
records also show that a total of 19 hamsters should have been reported in Column D, and 9 additional hamsters should
have been reported in Column B.
Correct reporting of all required information on the annual report is required so that the public, USDA APHIS Animal Care,
and Congress can have knowledge of the number, type, and pain category of animals used- or held for use in research.
Correct by February 1st, 2023, by submitting a corrected FY 2022 annual report to USDA APHIS Animal Care.
This inspection and exit interview were conducted with facility representatives.
n",0,No positive rules matched,[],[]
20db38f80f48e32e,3.108(b),,False,EMPLOYEES OR ATTENDANTS.,"No training records had been completed for staff working with the marine mammals. While some of the staff caring
for the animals had been doing so for as much as 10 years, the facility had not documented any of their training.
The facility should ensure that training records are maintained and made available for review by APHIS officials so
that said officials may assess the qualifications of facility staff.
Correct by April 15, 2015.
An exit briefing was conducted with a facility representative.",0,No positive rules matched,[],[]
ca1e0ec531d44748,3.101(a)(3),,False,"FACILITIES, GENERAL.","Some defects were observed on the surfaces inside the monk seal pool. The inspector returned to the facility on
3/22/17, when the pool was scheduled to be drained. Upon viewing the drained pool it was clearly evident that some
areas of the wall and floors of the pool have significantly deteriorated. On the wall, there are at least a dozen large
patches measuring up to five inches in diameter or more, where the original surface is missing, and the underlying
concrete has a roughened surface. On the floor, there are at least two areas where the surface has also failed,
including one two foot by one foot rectangle where eighty percent of the original surface is missing, and the
underlying surface is uneven and rough.
Failure to maintain the surfaces in good repair could result in ingestion of materials coming off of the pool walls and
floor, an inability to adequately clean and disinfect the surfaces, roughened pool bottom that could cause abrasions,
especially when the pool is drained, and / or the possibility of contaminants leaching through the unsealed,
deteriorated areas in the pool surface, which could affect water quality. Any of these could be detrimental to the
health and well-being of the animals.
Whereas the facility has contracted an architect to come up with plans for improvements to this exhibit, there is
currently no documented timeline for performing maintenance on the pool surfaces.
All surfaces in a marine mammal primary enclosure must be constructed of durable, nontoxic materials that facilitate
cleaning, and disinfection in order to maintain the desired water quality. All surfaces must be maintained in good
repair as part of a regular, ongoing maintenance program.
To be corrected by November 20, 2017.
This inspection was conducted on 3/20/17 and 3/22/17, and the inspection and exit interview were conducted with
facility representatives.",0,No positive rules matched,[],[]
9edb49fbad6b0a9a,2.131(b)(1),Critical,False,Handling of animals.,"On April 20, 2024, a peregrine falcon was unexpectedly startled during a presentation and escaped from its handler. The
handler had removed the bird from its travel enclosure, and the falcon panicked with a gust of wind and the handler lost
control of the restraint devices. The falcon was not recovered despite efforts to retrieve it. Escaped animals may suffer
physical harm, trauma, and stress. The facility must address handling to ensure animals are handled as expeditiously and
carefully as possible to minimize these risks. Corrective actions made by the facility included re-assessing exhibitions
during high winds and creating procedures for outdoor raptor handling, and searches.
Correct by 06/17/2024
This inspection and exit interview were conducted with Facility Representative.
n",0,No positive rules matched,[],[]
9805ea9f8e050ed2,2.40(b)(2),,False,ATTENDING VETERINARIAN AND ADEQUATE VETERINARY CARE (DEALERS AND EXHIBITORS).,"One cinnamon colored male Chihuahua that the facility representative estimated at 15 years old (microchip number
086-333-327) has a heavy coating of dark brown matter on his upper teeth. The dog was also missing all of its
bottom teeth. The abnormal buildup of material on the teeth can cause damage to the gum tissue and tooth
structure, be painful, impact the ability of the dog to eat normally and harm the health of the animal. The licensee
must have this animal examined by a veterinarian and appropriate plan administered. The outcome of this
examination must be documented and provided to the inspector upon request. The licensee must ensure that all
animals receive adequate veterinary care at all times.
To be corrected by August 11, 2014.
Exit interview conducted with facility representative at time of inspection.",0,No positive rules matched,[],[]
cdce4529d2d130e8,2.31(c)(7),,False,INSTITUTIONAL ANIMAL CARE AND USE COMMITTEE (IACUC).,"*** Protocol 256: A procedure was performed on a species not specified in the approved animal use protocol. Any
changes to a protocol must be reviewed and approved by the IACUC prior to conducting any activity associated with
the change. An IACUC review of protocol changes is to ensure that animals do not experience unnecessary pain
and distress and to verify that personnel are adequately trained to handle and conduct procedures on a particular
specied. The IACUC must amend the protocol to include goats as a species and/or implement appropriate
procedures to ensure protocol changes are reviewed and approved by the IACUC for all protocol deviations
involving the use of animals.
Correct by May 30, 2014.
NOTE: The goat did not experience any pain or distress as it was a terminal procedure performed under
anesthesia.",0,No positive rules matched,[],[]
cdce4529d2d130e8,2.40(b)(2),,False,ATTENDING VETERINARIAN AND ADEQUATE VETERINARY CARE (DEALERS AND EXHIBITORS).,"***Protocol 229: Rabbits on the study failed to receive a prescribed medical treatment for a day and a half.
Treatment for a medical condition must be adminsiterd as indicated by the atending veterinarian. Personnel must be
trained on the procedures for identifying animals on treatment according to facility standard operating procedures to
ensure the veterinarian's prescribed treatment is administered in a timely manner. Correct by April 18, 2014
An exit briefing was conducted with the facility representatives.",0,No positive rules matched,[],[]
64652b2ceb8aaa37,2.40(b)(2),,False,ATTENDING VETERINARIAN AND ADEQUATE VETERINARY CARE (DEALERS AND EXHIBITORS).,"Expired medications were found as follows:
SPF Clinic: 3 jars of Erythromycin tabs-exp 5/8/15, 1 vial Vit B inj-exp 7/15, 1 Gentocin spray-exp 7/11, 10 tubes of
Vetropolycin oint-exp 4/15, 1 vial of Aminophyline-exp 6/1/15
Conventional clinic: 1 jar of Erythromycin tabs-exp 5/8/15, 2 bottles of Amoxicillin--exp 1/15, 2 vials Cetazolin-exp
9/14.
Additionally, a vial of Penicillin G inj is currently being used to treat primates BA 74, AD 65, BP 15, & BK 19. When
this was discovered by this inspector during the inspection the veterinarian immedialtey changed the treatment to a
different antibiotic.
Expired medications are considered adulterated, and their use is not an appropriate method to prevent, control,
diagnose, and treat diseases and injuries.
The facility currently has a system for identifying expired medications, but it appears that this system is not entirely
effective. Institute improvements to assure that expired medications are removed and not administered to any
animals.
Correct immediately",0,No positive rules matched,[],[]
64652b2ceb8aaa37,3.78(d),,False,OUTDOOR HOUSING FACILITIES.,"On June 28, 2015, a person (or persons) entered the facility and facilitated the escape of 11 primates from their
enclosure. Ten of these primates were either captured or returned to their enclosure on their own. One primate is
still missing.
The facility inspected the perimeter fence and did not find any cuts or openings along the fence. An inspection of
the perimeter fence today showed that there was a space between the 2 service gates adjacent to the enclosure
which could be moved a few inches by hand. There was also a space between the bottom of another service gate
and the ground near enclosures 163/164 which also can be moved a few inches by hand. The perimeter fence is
not 6 feet high on the left side of the old feed bunker, and this section shall be raised to at least 6 feet high.
The perimeter fence shall restrict unauthorized persons (and animals) from entering the facility and having contact
with the animals. The perimeter fence shall be at least 6 feet high along its entire length.
Since this incident, the facility has provided additional security measures.
Correct by September 1, 2015
This was a partial inspection. The exit interview was conducted with the attending veterinarian.",0,No positive rules matched,[],[]
a9cb5b67637792b3,2.31(e)(3),,False,INSTITUTIONAL ANIMAL CARE AND USE COMMITTEE (IACUC).,"Protocol # A1500116 & 9040115 do not contain complete descriptions of the proposed use of the animals, nor does
it contain the actual numbers of animals that will be studied. These activities involving primates are reportedly a
continuation of other PI's terminated work but there is no mention of this in either protocol.
All protocols must contain a complete description of the proposed use of animals and the rational for such use. If a
protocol is an exact continuation of previous work, that shall be so stated in the protocol and available for review
during an Animal Welfare inspection. Any deviations to those previous protocols shall also be completely
described.
Correct by July 24, 2016",0,No positive rules matched,[],[]
a9cb5b67637792b3,2.33(b)(3),,False,ATTENDING VETERINARIAN AND ADEQUATE VETERINARY CARE.,"Primate 8Q6 was observed to have an opacity in the right eye. The vet techs indicated that he was born with large
eyes and has been this way since birth. They are continuously observing this condition. This condition, however,
was never reported to the attending veterinarian for examination, and has never received any veterinary care. The
veterinarian is the person who is qualified to assess the animal's health and well-being, and is the one who would
determine if an animal is suffering, or is experiencing pain &/or distress. He is also the one who would decide
whether no treatment, treatment, or euthanasia is appropriate.
A mechanism of direct and communication is required so that timely information on problems with animal health and
well-being is conveyed to the attending veterinarian so that he may determine if this animal is in pain, distress or
suffering; and to decide whether veterinary examination, care, or euthanasia is appropriate.
Correct immediately",0,No positive rules matched,[],[]
