hash_id,code,kind,repeat,desc,narrative,air_transport_flag,classification_explanation,matched_positive_rules,matched_negative_rules
e9f1c3e5f3c48398,3.137(e),,False,Primary enclosures used to transport live animals.,"The transport enclosures for the capybara and cavy did not have the words ""Live Animal"" or ""Wild Animal"" clearly marked
with arrows or other markings indicating the correct upright position of the enclosure.
A lack of clear markings can inhibit correct handling and cage orientation by first responders in the event of an
emergency.
The licensee must ensure that the words “Wild Animal” or “Live Animal” are marked on the top and on one or more sides
with letters at least 1 inch (2.5 cm) high, and have arrows or other markings to indicate the correct upright position of the
primary enclosure.
Correct by: July 8, 2024.
This inspection was completed at the Big Butler Fair in Prospect, PA.
This inspection and exit interview were conducted with the licensee and facility representatives.
n",0,No positive rules matched,[],[]
d50bb65a38127852,2.126(b),,False,ACCESS AND INSPECTION OF RECORDS AND PROPERTY; SUBMISSION OF ITINERARIES.,"***I arrived at the facility at 9:20 am and the gates were closed. I called the owner and he did not answer. I left a
message that I was at the facility to conduct an inspection. I waited for the customer for 30 minutes and called
again. There was no answer so I left a message that this would be an attemted inspection and that he would receive
the inspection report in the mail. I left the premises at 10:00 am. A responsible adult was not available and one
should have been available to accompany APHIS Officials during the inspection process at 9:20 am on 02/19/2014.",0,No positive rules matched,[],[]
c2b386d13baffe26,2.78(a),,False,HEALTH CERTIFICATION AND IDENTIFICATION.,"The facility has transported an adult male rhesus macaque into Tennessee to be sold at an exotic livestock auction.
No health certificiate executed and issued by a licensed veterinarian accompanied the macaque. A health certificate
is necessary when transporting a nonhuman primate in order to ensure that the nonhuman primate is free of
infectious disease or physical abnormality which would endanger the animal or other animals or endanger public
health. Correct from this day forward.
Inspection conducted at the exotic auction in Cookeville, TN.
Exit conducted with undersigned facility representative.
Additional Inspectors",0,No positive rules matched,[],[]
6dbcb45d24ddf9a3,2.40(a)(1),,False,ATTENDING VETERINARIAN AND ADEQUATE VETERINARY CARE (DEALERS AND EXHIBITORS).,"***The program of veterinary has not been completed and signed by an attending veterinarian. Maintaining a
complete and accurate program of veterinary care is important in reflecting the current practices and procedures of
preventative care at the facility. Must consult with attending veterinarian to ensure adequate veterinary care. Each
exhibitor shall employ an attending veterinarian under formal arrangements. In the case of a part-time attending
veterinarian or consultant arrangements, the formal arrangements shall include a written program of veterinary care
and regularly scheduled visits to the premises of the exhibitor. Correct Immediately.",0,No positive rules matched,[],[]
6dbcb45d24ddf9a3,2.75(a)(1),,False,RECORDS: DEALERS AND EXHIBITORS.,"***There were no records documenting the acquisition of two pigs, a llama and other covered species and the
exhibitor shall make, keep and maintain records or forms which correctly disclose the information of these animals.
The records shall include any offspring born of any animal while in his or her possession or under his or her control.
Correct by August 9, 2014.
The inspection and exit interview was conducted with the owner.",0,No positive rules matched,[],[]
00da37f7265ca872,2.75(a)(1),,True,RECORDS: DEALERS AND EXHIBITORS.,"** There were no records documenting the disposition of the male giraffe. The exhibitor shall make, keep and
maintain records or forms which correctly disclose the information of these animals. Correct by August 9, 2014.",0,No positive rules matched,[],[]
00da37f7265ca872,2.131(c)(1),,False,HANDLING OF ANIMALS.,"** The prairie dog's exhibit allows the public to touch the animals through the wire mesh top. The owner also stated
that the prairie dogs can jump and grab the wire. For the safety of the animal and the public there needs to be a
public barrier to prevent them from putting their fingers through the wire. During public exhibition, any animal must
be handled so there is minimal risk of harm to the animal and to the public, with sufficient distance and/or barriers
between the animal and the general viewing public so as to assure the safety of animals and the public. Correct by
September 3, 2015",0,No positive rules matched,[],[]
00da37f7265ca872,3.81,,False,ENVIRONMENT ENHANCEMENT TO PROMOTE PSYCHOLOGICAL WELL-BEING.,"** The facility has not developed an appropriate plan for environment enhancement for the baboon and lemurs. The
exhibitors must develop, document, and follow an appropriate plan for environment enhancement adequate to
promote the psychological well-being of nonhuman primates. The plan must be in accordance with the currently
accepted professional standards as cited in appropriate professional journals or reference guides, and as directed
by the attending veterinarian.This plan must be made available to APHIS upon request. Correct by August 27, 2015",0,No positive rules matched,[],[]
00da37f7265ca872,3.127(d),,False,"FACILITIES, OUTDOOR.","** The perimeter fence that borders the giraffe barn has areas where outside animals can gain access to the park.
The perimeter fence consists of dead pine trees on the bottom third and cow panel on the top two-thirds. In some
areas there is a clearing between the pine trees and the cow panels that needs to be sealed to keep predators out
of the park for the safety of the animals. The fence must be constructed so that it protects the animals by restricting
unauthorized humans, and animals the size of dogs, skunks, and raccoons from going through it or under it. Correct
by September 3, 2015.
The inspection and exit interview was conducted with the owner.",0,No positive rules matched,[],[]
156d6989fbe01c45,2.40(a)(2),,True,ATTENDING VETERINARIAN AND ADEQUATE VETERINARY CARE (DEALERS AND EXHIBITORS).,"** There were two great pyrenees puppies that was diagnosed with sarcoptic mange by the attending veterinarian.
They were being housed along with 3 young llama(cid:25)s. The attending veterinarian stated that she wanted all of the
animals to be treated with injectable ivermectin. Instead the llamas were treated with oral ivermectin by the owner.
The owner stated that he did not know that he was not supposed to treat the animals orally. Since the owner was
said to have already treated the animals the veterinarian was unable to treat with the injectable for fear of overdose.
There are no records of the oral ivermectin being given, the amount, dosage and route in which the medication was
administered to the animals. To ensure the proper medication was given and the condition was treated
appropriately the attending veterinarian should have the appropriate authority to make sure the provision of
adequate veterinary care has been given to the animals.",0,No positive rules matched,[],[]
156d6989fbe01c45,2.75(a)(1),,True,RECORDS: DEALERS AND EXHIBITORS.,"** There were no records documenting the acquisition and disposition of two great pyrenees puppies and 3 young
llamas. The exhibitor shall make, keep and maintain records or forms which correctly disclose the information on
these animals.
This was a focused inspection. The exit interview was conducted with the owner.",0,No positive rules matched,[],[]
44ed58f651fe56cf,2.40(a)(1),,True,ATTENDING VETERINARIAN AND ADEQUATE VETERINARY CARE (DEALERS AND EXHIBITORS).,"***The licensee uses a veterinarian under consulting arrangements to provide veterinary care for the animals but
does not have a formal agreement nor a written program of veterinary care. In order to ensure problems of animal
health are addressed adequately and timely, a written program of veterinary care must be maintained and followed.
Each licensee shall employ an attending veterinarian under formal arrangements. In the case of a part-time
attending veterinarian or consultant arrangements, the formal arrangements shall include a written program of
veterinary care and regularly scheduled visits to the premises of the licensee.",0,No positive rules matched,[],[]
44ed58f651fe56cf,2.75(b)(1),,True,RECORDS: DEALERS AND EXHIBITORS.,"***The licensee did not have records that contained the required information regarding the correct number of
inventory, gender, age and location of animals on hand. Records containing the required information for animals
acquired for use in regulated activities, including those offspring born on premise, need to be made and maintained
in order to properly track the animal numbers and use in those activities.",0,No positive rules matched,[],[]
44ed58f651fe56cf,3.81,,True,ENVIRONMENT ENHANCEMENT TO PROMOTE PSYCHOLOGICAL WELL-BEING.,"***An environmental enhancement plan to promote the psychological well-being of all non-human primates currently
housed at this facility has not been approved by the attending veterinarian. A written plan must be developed and
followed for all nonhuman primates. This plan must be in accordance with current accepted professional standards.
The inspection and exit interview was conducted with the licensee, Dr. Annette Chapman and Dr. Bart Sutherland
Additional Inspectors
Chapman Annette, Veterinary Medical Officer",0,No positive rules matched,[],[]
9414af45d99ef126,2.131(c)(1),Critical,False,HANDLING OF ANIMALS.,"On May 6, 2017 a kangaroo reached through the fence and scratched and bite a small child that was standing next
to the enclosure fence. There was no public barrier present to prevent an animal from reaching out of the enclosure
or to prevent someone from reaching into the enclosure. There must be some type of barrier to provide a sufficient
distance between the animal and the viewing public so as to assure the safety of the public. Correct immediately.
This focused inspection of the kangaroo enclosure and exit interview were conducted with owner.",0,No positive rules matched,[],[]
55cc737fbb91835d,2.40(b)(3),Critical,False,ATTENDING VETERINARIAN AND ADEQUATE VETERINARY CARE (DEALERS AND EXHIBITORS).,"There was a dead piglet observed in a shed in the pig enclosure. When shown to the facility representative, he was
not aware the piglet had died. There was an accumulation of mud in the upper part of the enclosure where the shed
was located from recent rains. Several piglets were observed to have difficulty ambulating in the deep mud.
It is possible the excessive thick mud was a factor in the piglet’s death. The facility should be observing the animals
daily to be aware of any issues that may impact the health of animals and cause injury or death.
The facility corrected the issue during the inspection by placing a new shed in the lower part of the enclosure where
the ground was dry.
CORRECT BY: Corrected during the inspection.",0,No positive rules matched,[],[]
55cc737fbb91835d,2.75(b)(1),,False,RECORDS: DEALERS AND EXHIBITORS.,"There were incomplete records of acquisition and disposition.
Complete records of the animals currently being housed including their acquisition and disposition is necessary in
order to accurately track animals to ensure humane care and use of the animals.
Exhibitors must make, keep, and maintain records which fully and correctly disclose information concerning animals
purchased or otherwise acquired, owned, held, leased, or otherwise in his or her possession or under his or her
control, or which is transported, sold, euthanized, or otherwise disposed of by that dealer or exhibitor.
CORRECT BY: 9-25-19",0,No positive rules matched,[],[]
55cc737fbb91835d,2.131(c)(1),,False,HANDLING OF ANIMALS.,"The enclosure housing the single lemur did not have a public barrier to prevent contact with the animal.
Such unauthorized contact poses a possible risk of injury to both members of the public and the lemur.
The facility must handle animals so there is minimal risk of harm to the animal and to the public, with sufficient
distance and/or barriers between the animal and the general viewing public so as to assure the safety of animals
and the public.
CORRECT BY: 9-4-19",0,No positive rules matched,[],[]
55cc737fbb91835d,3.81,,False,ENVIRONMENT ENHANCEMENT TO PROMOTE PSYCHOLOGICAL WELL-BEING.,"There was no program for environment enhancement for the 3 lemurs. There was one lemur being housed
individually and two lemurs being housed together. The single lemur was unable to see the other two lemurs.
Nonhuman primates have social needs and needs for environmental enrichment which, if not addressed, may lead
to negative effects on their psychological well-being.
Exhibitors must develop, document, and follow an appropriate plan for environment enhancement adequate to
promote the psychological well-being of nonhuman primates. The plan must include provisions to address the
social needs of nonhuman primates which exist in social groups in nature.
CORRECT BY: 9-25-19",0,No positive rules matched,[],[]
55cc737fbb91835d,3.125(a),,False,"FACILITIES, GENERAL.","The fence around the giraffe enclosure at the top corner was disconnected from the corner post and in need of
repair. The fence around the oryx was bent over in one area and in need of repair. The fence at the perimeter of
the property adjacent to the road and containing the exotic hoofstock was in severe disrepair in one area. The
fence there was essentially missing, with logs piled to prevent animal escape and a piece of black plastic had been
used to span the gap.
Animal injury may result from fencing in poor repair or from attempts of the animal to escape through damaged
fencing or subsequent to their escape.
The facility must be structurally sound and be maintained in good repair.
CORRECT BY: Temporary correction-9-4-19. Permanent correction-9-25-19.",0,No positive rules matched,[],[]
55cc737fbb91835d,3.125(c),,False,"FACILITIES, GENERAL.","The animal feed was stored in two structures near the pig enclosure. Some of the food was stored in closed plastic
bins. However, there were several bags of feed that were being stored directly on the ground and the bags were
opened with no means of securing them closed. In addition, there were rodenticide chemicals in spray bottles being
stored directly above open bags of feed which could possibly contaminate the feed if the bottles leaked. A large
number of bags of feed were piled on the floor on top of each other and next to each other with no space
underneath or around the bags to allow cleaning.
Food contaminated by chemicals or through improper storage may have a negative effect on animal health and
welfare.
Supplies of food should be stored in a manner which adequately protects them against deterioration, molding, or
contamination by vermin.
CORRECT BY: 9-4-19.",0,No positive rules matched,[],[]
55cc737fbb91835d,3.131(c),,False,SANITATION.,"There was a large amount of spilled feed on the floor of one of the animal feed sheds. There were numerous rodent
droppings observed on the floor of the sheds and on top of the refrigerators. The interior of the refrigerators in both
sheds, which were used to store some of the perishable animal feed items, contained unidentified residue and were
in need of cleaning. There were discarded items, used cups and other debris in the grain bin, which presently was
not used for food storage.
Inadequate cleaning and repair may adversely impact the health and welfare of the animals.
Premises must be kept clean and in good repair.
CORRECT BY: 9-4-19.",0,No positive rules matched,[],[]
55cc737fbb91835d,3.131(d),,False,SANITATION.,"There was evidence of rodent activity, including numerous rodent droppings observed in the animal feed sheds and
observation of a rat removing a food pellet from a lemur enclosure.
Rodents may carry diseases that negatively impact the health and welfare of animals.
The facility must establish and maintain a safe and effective pest control program.
CORRECT BY: 9-4-19.
The inspection took place 27-28 August 2019.
This inspection and exit interview were conducted with the facility representative.
Additional Inspectors
Schnell Michael, Veterinary Medical Officer",0,No positive rules matched,[],[]
b051d46a2f2eccdb,3.125(a),,True,"FACILITIES, GENERAL.","Temporary corrections have been completed for the fence around the giraffe enclosure and the fence at the
perimeter of the property adjacent to the road. The fence around the oryx was still bent over in one area and in need
of repair. Animal injury may result from fencing in poor repair or attempts of the animal to escape through damaged
fencing. The facility must be structurally sound and maintained in good repair.",0,No positive rules matched,[],[]
b051d46a2f2eccdb,3.127(a),,False,"FACILITIES, OUTDOOR.","At approximately 1:00PM, the camel enclosure- which contained one camel- was in the direct sun and there was no
shade available to the camel. Lack of shade can contribute to heat stress or discomfort for the animal. The facility
shall provide sufficient shade by natural or artificial means. Correct by October 7th, 2019.",0,No positive rules matched,[],[]
b051d46a2f2eccdb,3.127(b),,False,"FACILITIES, OUTDOOR.","The camel enclosure, which contained one camel, did not provide any natural or artificial shelter. Shelter from
inclement weather is necessary to provide protection and comfort for the animal. The facility shall provide natural or
artificial shelter from inclement weather. Correct by October 7th, 2019.
This was a focused inspection on noncompliances cited on the previous inspection report. This inspection and exit
interview were conducted with the facility representative.
Additional Inspectors
Brunkhorst Susanne, Veterinary Medical Officer",0,No positive rules matched,[],[]
39edaf55a354a747,2.75(b)(1),,True,RECORDS: DEALERS AND EXHIBITORS.,"There were incomplete records of acquisition and disposition.
Complete records of the animals currently being housed including their acquisition and disposition is necessary in
order to accurately track animals to ensure humane care and use of the animals.
Exhibitors must make, keep, and maintain records which fully and correctly disclose information concerning animals
purchased or otherwise acquired, owned, held, leased, or otherwise in his or her possession or under his or her
control, or which is transported, sold, euthanized, or otherwise disposed of by that dealer or exhibitor.",0,No positive rules matched,[],[]
39edaf55a354a747,2.131(c)(1),,True,HANDLING OF ANIMALS.,"The enclosure housing the single lemur did not have a public barrier to prevent contact with the animal. The wire
mesh of the enclosure is large enough that people could stick fingers or objects through the mesh. The lemur was
observed sticking his fingers through the wire. There was an area of the mesh where there was a larger opening,
which the licensee stated was to facilitate feeding treats to the lemur.
Unauthorized contact poses a possible risk of injury to both members of the public and the lemur.
The facility must handle animals so there is minimal risk of harm to the animal and to the public, with sufficient
distance and/or barriers between the animal and the general viewing public so as to assure the safety of animals
and the public.",0,No positive rules matched,[],[]
39edaf55a354a747,3.127(b),,True,"FACILITIES, OUTDOOR.","The camel enclosure, which contained one camel, did not provide any natural or artificial shelter from inclement
weather. Shelter from inclement weather is necessary to provide protection and comfort for the animal. The facility
shall provide natural or artificial shelter from inclement weather.",0,No positive rules matched,[],[]
39edaf55a354a747,3.127(d),,False,"FACILITIES, OUTDOOR.","The fence at the perimeter of the property adjacent to the road and containing the exotic hoofstock was not
continuous, was not structurally sound, and was not 6 feet tall in all areas. The perimeter fence was falling down in
some areas. There were multiple gaps between where different fencing materials came together.
Perimeter fencing prevents unauthorized entry of people and animals. Animal injury may result from poor fencing or
from attempts of the animals to escape through damaged fencing or subsequent to their escape.
Correct by: January 1, 2020.
This inspection and exit interview were conducted with the facility owner.
Additional Inspectors
Schnell Michael, Veterinary Medical Officer",0,No positive rules matched,[],[]
cd54f7605d896ecb,2.126(b),,False,ACCESS AND INSPECTION OF RECORDS AND PROPERTY; SUBMISSION OF ITINERARIES.,"A responsible adult was not available to accompany APHIS Officials during the inspection process at 1300-1330
hours on 07-JAN-20.
Honked, called out loudly, made contact with facility employee who stated that facility owner was unavailable.
Called and left message on phone number provided. Waited 30 minutes.
Additional Inspectors
Depoe Angela, Animal Care Inspector",0,No positive rules matched,[],[]
90f17819ba914fa3,2.126(b),,True,ACCESS AND INSPECTION OF RECORDS AND PROPERTY; SUBMISSION OF ITINERARIES.,"A responsible adult was not available to accompany APHIS Officials during the inspection process at 2:04PM on
24-FEB-20.
Arrived at 2:04PM. Honked, called out loudly, called and left message on office number and cell phone number.
Waited 30 minutes. Put leave-behind flyer on the gait. Left at 2:34PM.
Additional Inspectors
Arango Juan, Permit Specialist",0,No positive rules matched,[],[]
dbfd1c87f83830f1,3.125(a),,True,"Facilities, general.","Some of the fencing and structures in the blackbuck enclosure and the giraffe enclosure are in poor repair.
Approximately 15 feet of fence on the right side of the enclosure containing 15 blackbuck is bent or leaning over. The
fence is comprised of wooden posts and metal wire panels. A tree has fallen on the fence and in this area there were two
wire panels held together by a strap or tie. The edges of some of the wire panels have sharp points. There is an
approximately 12 foot by 12 foot wooden shelter structure in the blackbuck enclosure that has a sagging roof, and the
roof has become separated from the far wall.
The outdoor section of the enclosure housing one adult male giraffe is made of wood posts and metal wire panels. At
least 4 wooden boards within the fence are broken, and 2 more boards are falling down from the top of the fence. Two of
the boards have nails sticking out of them. Numerous posts are leaning outwards.
Adequate structural strength and regular maintenance of fences and shelter structures is important for animal comfort,
health, and wellbeing. Animals can escape or become injured by inadequate or poorly maintained fences, and shelter
structures that are falling down may fail to provide adequate shelter from the elements.
Correct by maintaining facilities and enclosures that are structurally sound and in good repair to protect the animals from
injury and contain the animals within.",0,No positive rules matched,[],[]
dbfd1c87f83830f1,3.127(d),Critical,True,"Facilities, outdoor.","In April 2020 one David's deer, two sika deer, and two sheep were killed by predators at the facility. Coyotes were
observed in the area around the time of the deaths, and a gap beneath the perimeter fence was found that appeared to
be dug out by coyotes, wild dogs, or other wildlife predators. The gap was identified and filled in with concrete and no
additional deaths have occurred due to predation since that time.
The perimeter fence beside the giraffe enclosure, next to the road, is in poor repair. The fence consists of 6 foot tall metal
wire fencing next to the road, with black plastic tarps in some areas. The metal fence has some gaps and openings and is
less than 6 feet tall in some areas. Inside the metal fence there is a partially competed solid wood fence, which is leaning
outwards in some areas. There are numerous trees, bushes, and vines close to the fence and touching the fence.
Animals who are not protected by an adequate perimeter fence may be injured, killed, or sickened by contact with wildlife,
unauthorized people, or stray animals. Animals who are killed by predators suffer from stress, pain, and injury or death.
Correct by maintaining a perimeter fence that is of sufficient height and strength to prevent access by unauthorized
people or animals, and which acts as secondary containment in the event that an animal escapes from its primary
enclosure.
This inspection and exit interview were conducted with the facility owner.
End Section",0,No positive rules matched,[],[]
